pr_number,title,url,status,created_at,merged_at,closed_at,labels,component,num_commits,additions,deletions,changed_files,review_comments_count,days_open,reviewers,related_issues,summary,potential_rationale,category,change_type
31648,[28.x] Backports,https://github.com/bitcoin/bitcoin/pull/31648,merged,2025-01-13T15:12:33Z,2025-03-05T17:35:10Z,2025-03-05T17:35:10Z,Backport;CI failed,,5,44,55,8,0,51,stickies-v;willcl-ark,,This is a backport PR that brings four previously merged changes to the 28.x release branch. The specific changes being backported are referenced by their PR numbers.,"This likely helps maintain the 28.x release branch by incorporating important fixes or improvements that were merged into the main development branch, ensuring users on the stable release get critical updates.",other,bugfix
31671,Update leveldb subtree to latest upstream,https://github.com/bitcoin/bitcoin/pull/31671,merged,2025-01-16T11:13:12Z,2025-01-21T17:01:24Z,2025-01-21T17:01:24Z,,,3,8,63,8,0,5,hebasto;theuni,29852,Updates Bitcoin Core's embedded leveldb database library to the latest upstream version. This includes three specific changes from the leveldb-subtree repository.,"This may help improve database performance, fix potential bugs, or add security improvements from the upstream leveldb project, which could enhance Bitcoin Core's blockchain storage reliability and efficiency.",build,feature
31766,leveldb: pull upstream C++23 changes,https://github.com/bitcoin/bitcoin/pull/31766,merged,2025-01-30T14:01:28Z,2025-03-20T05:03:59Z,2025-03-20T05:03:59Z,,,3,23,13,4,0,48,darosior;dergoegge,,Cherry-picks two commits from upstream leveldb that remove usage of deprecated C++ features (std::aligned_storage/std::aligned_union) to maintain C++23 compatibility.,"This likely ensures Bitcoin Core remains compatible with newer C++ standards and compilers, which may help with future maintenance, security, and performance as the C++ ecosystem evolves.",build,cleanup
31818,guix: remove test-security/symbol-check scripts,https://github.com/bitcoin/bitcoin/pull/31818,merged,2025-02-07T15:57:54Z,2025-02-12T08:48:01Z,2025-02-12T08:48:01Z,Build system,Build system,1,2,327,5,2,4,hebasto;theuni,31698;31715,Removes the test-security and symbol-check scripts from the Guix build system. The author argues these scripts have become more problematic than helpful since adopting Guix for release builds.,"This appears to streamline the build process by removing tests that may have become redundant with Guix's deterministic build environment, potentially reducing build complexity and maintenance burden.",build,cleanup
31819,doc: swap CPPFLAGS for APPEND_CPPFLAGS,https://github.com/bitcoin/bitcoin/pull/31819,merged,2025-02-07T16:09:50Z,2025-02-10T14:56:16Z,2025-02-10T14:56:16Z,Docs,Docs,1,2,2,1,0,2,hebasto,,"Updates documentation to replace CPPFLAGS with APPEND_CPPFLAGS in examples. The current documentation shows a variable that CMake doesn't recognize, leading to warning messages.","This likely helps developers and users who follow the documentation avoid confusion and build warnings when using CMake, which may improve the overall developer experience and reduce support burden.",docs,docs
31820,build: consistently use `CLIENT_NAME` in libbitcoinkernel.pc.in,https://github.com/bitcoin/bitcoin/pull/31820,merged,2025-02-07T16:15:46Z,2025-02-10T10:00:55Z,2025-02-10T10:00:56Z,Build system,Build system,1,1,1,1,0,2,hebasto;luke-jr;stickies-v;theuni,,Updates the libbitcoinkernel.pc.in file to consistently use the CLIENT_NAME variable instead of hardcoded values. This is a follow-up fix to ensure proper naming consistency in the pkg-config file.,"This change likely helps maintain consistent branding and naming across Bitcoin Core's build artifacts, which may be important for downstream projects that depend on libbitcoinkernel and use pkg-config to discover build information.",build,cleanup
31840,depends: add missing Darwin objcopy,https://github.com/bitcoin/bitcoin/pull/31840,merged,2025-02-11T10:56:05Z,2025-02-12T17:51:04Z,2025-02-12T17:51:04Z,Build system,Build system,1,1,0,1,0,1,djs19901;laanwj;theuni,,Adds the missing Darwin objcopy tool reference to the CMake toolchain configuration. Currently the toolchain file references a non-existent objcopy tool for Darwin cross-compilation builds.,"This change appears to improve the correctness of the build system by ensuring all toolchain references point to actual tools, which may prevent potential build failures or confusion for developers working on Darwin cross-compilation, even though objcopy isn't currently used in Darwin builds.",build,bugfix
31849,depends: set `CMAKE_*_COMPILER_TARGET` in toolchain,https://github.com/bitcoin/bitcoin/pull/31849,merged,2025-02-12T17:00:20Z,2025-03-27T07:35:14Z,2025-03-27T07:35:14Z,Build system,Build system,1,5,0,2,2,42,hebasto;willcl-ark,31748,Sets the CMAKE_*_COMPILER_TARGET variable in the toolchain file to follow CMake's recommended approach for cross-compilation with Clang. This prevents duplicated target flags on the compiler command line.,"This change likely improves build reliability and follows CMake best practices, which may help prevent compilation issues and ensure more predictable cross-compilation behavior, particularly for Apple platform builds where duplicate target flags could cause problems.",build,cleanup
31850,ci: switch MSAN to use prebuilt Clang binaries,https://github.com/bitcoin/bitcoin/pull/31850,closed,2025-02-12T17:45:01Z,,2025-02-20T15:14:50Z,Tests,Tests,1,9,21,3,1,7,fanquake;maflcko,,Changes the Memory Sanitizer (MSAN) CI configuration to use prebuilt Clang binaries from apt.llvm.org instead of building from source. This updates the testing infrastructure to use packaged binaries.,"This change likely improves CI build times and reliability by using maintained binary packages instead of compiling Clang from source, which may reduce CI infrastructure costs and make the testing process more stable and faster for memory sanitizer checks.",tests,cleanup
31857,depends: avoid an unset `CMAKE_OBJDUMP`,https://github.com/bitcoin/bitcoin/pull/31857,merged,2025-02-13T13:07:58Z,2025-02-14T09:49:15Z,2025-02-14T09:49:15Z,Build system,Build system,1,1,0,1,0,0,hebasto;theuni,31840,Fixes the Linux toolchain file to properly set CMAKE_OBJDUMP instead of leaving it as an empty string. This ensures consistency with other toolchain variables that point to actual cross-compilation tools.,"This change appears to improve toolchain file completeness and consistency, which may help prevent potential build issues or confusion for developers doing Linux cross-compilation, ensuring all expected tools are properly referenced even if not currently used.",build,bugfix
31864,doc: add missing copyright headers,https://github.com/bitcoin/bitcoin/pull/31864,merged,2025-02-14T15:44:40Z,2025-05-20T11:18:46Z,2025-05-20T11:18:47Z,Docs,Docs,4,40,17,14,6,94,i-am-yuvi;l0rinc;willcl-ark,,Adds missing copyright headers to various files and removes some obsolete documentation and code.,"This likely helps ensure proper legal compliance and code attribution, which may be important for a project like Bitcoin Core that needs clear licensing. Removing obsolete content appears to help maintain code cleanliness.",docs,cleanup
31865,build: move `rpc/external_signer` to node library,https://github.com/bitcoin/bitcoin/pull/31865,merged,2025-02-14T15:45:13Z,2025-02-14T22:32:36Z,2025-02-14T22:32:36Z,Build system,Build system,1,1,4,2,0,0,TheCharlatan;hebasto,,Moves the RPC external signer functionality from the common library to the node library and removes a dependency check suppression.,This appears to improve the organization of code modules by placing external signer RPC functionality in a more appropriate library location. This may help with build efficiency and clearer separation of concerns in the codebase.,build,refactor
31892,build: remove ENABLE_HARDENING condition from check-security,https://github.com/bitcoin/bitcoin/pull/31892,merged,2025-02-17T17:13:11Z,2025-02-18T15:37:35Z,2025-02-18T15:37:35Z,Build system,Build system,1,5,9,1,0,0,TheCharlatan;hebasto,,Removes a conditional check that would skip security hardening verification in release builds.,This likely strengthens security by ensuring that hardening checks always run in release builds rather than being silently skipped. This may help prevent accidentally shipping releases without proper security hardening enabled.,build,bugfix
31982,scripted-diff: rename libmultiprocess repository,https://github.com/bitcoin/bitcoin/pull/31982,merged,2025-03-04T11:33:49Z,2025-03-05T14:24:18Z,2025-03-05T14:24:18Z,Refactoring,,1,7,7,3,0,1,hebasto,,Renames references to the libmultiprocess repository in preparation for moving it to the bitcoin-core organization.,"This appears to be organizational housekeeping that may help consolidate Bitcoin Core related repositories under a single organization, likely improving project management and visibility.",build,refactor
31983,build: don't show ccache summary with MSVC,https://github.com/bitcoin/bitcoin/pull/31983,merged,2025-03-04T11:47:57Z,2025-03-05T09:54:33Z,2025-03-05T09:54:33Z,Build system,Build system,1,2,0,1,2,0,hebasto,31771,Prevents ccache summary information from being displayed when building with MSVC compiler.,"This likely fixes misleading build configuration output on Windows builds using MSVC, where ccache isn't actually being used. This may help developers avoid confusion about their build setup.",build,bugfix
31993,ci: use LLVM 20.1.0 for MSAN,https://github.com/bitcoin/bitcoin/pull/31993,merged,2025-03-05T10:52:50Z,2025-03-06T17:20:07Z,2025-03-06T17:20:07Z,Tests,Tests,1,1,1,1,0,1,,,Updates the continuous integration system to use the official LLVM 20.1.0 release instead of the release candidate version for Memory Sanitizer (MSAN) testing.,"This likely ensures more stable and reliable testing infrastructure by using the final LLVM release, which may help catch memory-related bugs more effectively during development.",tests,cleanup
31996,doc: link to benchcoin over bitcoinperf,https://github.com/bitcoin/bitcoin/pull/31996,merged,2025-03-05T13:59:44Z,2025-03-08T10:47:18Z,2025-03-08T10:47:18Z,Docs,Docs,1,1,3,1,0,2,hebasto;laanwj,,Updates documentation to link to the benchcoin repository instead of bitcoinperf for Bitcoin Core benchmarking tools.,"This appears to direct developers to the currently maintained benchmarking tool, which may help ensure performance testing remains effective as the project evolves.",docs,docs
31997,doc: update location of minisketch repository,https://github.com/bitcoin/bitcoin/pull/31997,merged,2025-03-05T14:14:52Z,2025-03-05T14:49:57Z,2025-03-05T14:49:57Z,Docs,Docs,1,2,2,2,0,0,hebasto;theStack,,Updates documentation to reflect that the minisketch repository has moved to a new location under bitcoin-core organization.,"This likely ensures developers can find the correct repository for the minisketch library, which may be important for understanding or contributing to Bitcoin's transaction relay optimizations.",docs,docs
31998,depends: patch around PlacementNew issue in capnp,https://github.com/bitcoin/bitcoin/pull/31998,merged,2025-03-05T15:13:02Z,2025-03-13T00:52:47Z,2025-03-13T00:52:47Z,Build system,Build system,1,76,0,2,2,7,TheCharlatan;ryanofsky,31772;29796;31772,Applies a patch to work around a PlacementNew issue in the capnp (Cap'n Proto) dependency used in the build system.,"This likely resolves build failures that could prevent developers from compiling Bitcoin Core, which may be essential for maintaining cross-platform compatibility and development workflow continuity.",build,bugfix
32000,Update minisketch subtree to d1e6bb8bbf8ef104b9dd002cab14a71b91061177,https://github.com/bitcoin/bitcoin/pull/32000,merged,2025-03-05T15:39:03Z,2025-03-07T12:38:12Z,2025-03-07T12:38:12Z,,,2,3,3,2,0,1,hebasto,,"Updates the minisketch subtree to a newer commit, incorporating upstream changes from the minisketch library.","This likely brings bug fixes or improvements to the minisketch implementation, which may help optimize Bitcoin's transaction relay efficiency and reduce bandwidth usage in the peer-to-peer network.",other,cleanup
32002,doc: add note to Windows build about stripping bins,https://github.com/bitcoin/bitcoin/pull/32002,merged,2025-03-05T16:54:44Z,2025-03-08T11:44:06Z,2025-03-08T11:44:06Z,Docs;Windows,Docs,1,12,3,1,8,2,hebasto;hodlinator,30593;30593,Adds documentation note to Windows build instructions about using the --strip flag to reduce binary size from nearly 500mb when debug info is included.,"This likely helps Windows developers and users manage disk space more efficiently, as Bitcoin Core binaries with debug symbols can become extremely large and may be impractical for regular use.",docs,docs
32003,doc: remove note about macOS self-signing,https://github.com/bitcoin/bitcoin/pull/32003,merged,2025-03-05T17:21:59Z,2025-03-06T18:00:35Z,2025-03-06T18:00:35Z,Docs,Docs,1,0,7,1,0,1,luke-jr,31407,Removes documentation note about macOS self-signing as a followup to a previous pull request.,This appears to be cleanup work that may simplify the build process for macOS users by removing outdated or unnecessary signing requirements that were addressed in a previous change.,docs,cleanup
32009,contrib: turn off compression of macOS SDK to fix determinism (across distros),https://github.com/bitcoin/bitcoin/pull/32009,merged,2025-03-06T16:23:34Z,2025-11-27T15:03:54Z,2025-11-27T15:03:54Z,Scripts and tools,,3,23,26,4,15,265,l0rinc;stickies-v,31873,Modifies the macOS SDK tarball creation to be more selective about included files and removes compression to fix determinism issues across different Linux distributions.,"This likely helps ensure reproducible builds across different development environments, which may be important for Bitcoin's security model where build determinism helps verify that binaries haven't been tampered with.",build,bugfix
32038,depends: remove `NO_HARDEN` option,https://github.com/bitcoin/bitcoin/pull/32038,merged,2025-03-12T12:06:11Z,2025-03-14T03:02:26Z,2025-03-14T03:02:27Z,Build system,Build system,1,4,21,5,0,1,laanwj,,"Removes the NO_HARDEN option from the depends build system, which was previously needed to work around a Windows-specific issue that no longer occurs.","This likely strengthens Bitcoin Core's security posture by removing a carveout that disabled hardening features, and may simplify the build system by eliminating code that works around obsolete issues.",build,cleanup
32081,depends: patch Qt rounding bugs,https://github.com/bitcoin/bitcoin/pull/32081,closed,2025-03-17T08:14:35Z,,2025-04-02T06:43:44Z,Build system,Build system,1,102,0,2,0,15,ryanofsky,29796,Patches Qt rounding bugs that were causing runtime failures in 32-bit Clang GUI wallet tests when compiled with -O0 optimization.,This likely improves the reliability of Bitcoin Core's GUI wallet functionality on 32-bit systems and may help developers who need to build with debug optimization levels for testing or development purposes.,build,bugfix
32226,ci: switch to LLVM 20 in tidy job,https://github.com/bitcoin/bitcoin/pull/32226,merged,2025-04-06T00:00:39Z,2025-04-23T12:36:05Z,2025-04-23T12:36:05Z,Tests,Tests,2,17,17,12,5,17,hebasto;l0rinc,,Updates the continuous integration tidy job to use LLVM version 20 instead of an older version.,"This likely helps ensure Bitcoin Core is tested against the latest LLVM toolchain, which may provide better static analysis capabilities and help catch potential code issues earlier in development.",tests,test
32252,[29.x] doc: minor rel notes changes,https://github.com/bitcoin/bitcoin/pull/32252,merged,2025-04-11T15:04:58Z,2025-04-11T15:20:17Z,2025-04-11T15:20:17Z,Backport,,1,0,103,2,0,0,Jacksdad2015;janb84;jonatack,,"Makes minor documentation changes to release notes for the 29.x branch, removing unused headers and empty templates.",This appears to be routine maintenance that may help streamline the release process and ensure documentation templates are properly structured for point releases.,docs,cleanup
32288,ci: drop -priority-level from bench in win cross CI,https://github.com/bitcoin/bitcoin/pull/32288,merged,2025-04-16T15:32:26Z,2025-04-17T10:34:42Z,2025-04-17T10:34:42Z,Tests,Tests,1,1,1,1,8,0,hebasto;mabu44,32277,Removes the priority-level flag from benchmark testing in Windows cross-compilation CI to ensure all benchmarks are tested.,"This likely helps improve test coverage by ensuring that all performance benchmarks are validated in CI, which may help catch performance regressions across the full benchmark suite.",tests,test
32292,[29.x] Backports,https://github.com/bitcoin/bitcoin/pull/32292,merged,2025-04-17T10:55:40Z,2025-05-22T11:05:25Z,2025-05-22T11:05:26Z,Backport,,22,137,320,22,1,35,hebasto;willcl-ark,32184;32187;32248;32286;32312;32336;32353;32356;32389;32437;32454;32469;32483;32553,Backports multiple pull requests and fixes to the 29.x maintenance branch.,"This appears to be routine maintenance that likely brings important bug fixes and improvements to users running the 29.x version, helping maintain stability and security for that release branch.",other,bugfix
32299,[28.x] Backports,https://github.com/bitcoin/bitcoin/pull/32299,merged,2025-04-17T14:27:08Z,2025-05-13T13:02:36Z,2025-05-13T13:02:36Z,Backport;CI failed,,6,56,25,11,0,25,willcl-ark,32070;32187;32286;32336,Backports several pull requests to the 28.x maintenance branch.,"This likely provides important fixes and improvements to users still running the 28.x version, which may help maintain security and stability for that older but still supported release.",other,bugfix
32403,test: remove Boost SIGCHLD workaround.,https://github.com/bitcoin/bitcoin/pull/32403,merged,2025-05-02T10:03:54Z,2025-05-02T21:10:50Z,2025-05-02T21:10:50Z,Tests,Tests,1,0,8,1,0,0,hebasto;laanwj;mabu44,,Removes an outdated workaround for Boost library SIGCHLD signal handling in tests. The workaround is no longer needed since the related code was removed from the Boost library itself.,This likely helps maintain code cleanliness and may reduce technical debt by removing obsolete code that could potentially cause confusion or conflicts with newer versions of dependencies.,tests,cleanup
32405,build: replace header checks with `__has_include`,https://github.com/bitcoin/bitcoin/pull/32405,merged,2025-05-02T15:31:21Z,2025-05-05T14:19:43Z,2025-05-05T14:19:43Z,Build system,Build system,1,4,24,4,0,2,TheCharlatan;hebasto;shahsb,,Replaces CMake header file existence checks with the modern C++17 `__has_include` preprocessor feature. This modernizes the build system to use standard library functionality instead of build-time checks.,"This appears to streamline the build process and may improve build reliability by using standardized C++17 features, potentially reducing build system complexity and improving portability across different environments.",build,refactor
32437,crypto: disable ASan for sha256_sse4 with Clang,https://github.com/bitcoin/bitcoin/pull/32437,merged,2025-05-07T10:54:28Z,2025-05-08T08:08:47Z,2025-05-08T08:08:47Z,Utils/log/libs,Utils/log/libs,1,6,2,1,0,0,hebasto;laanwj,31913,Disables AddressSanitizer (ASan) for the SHA256 SSE4 cryptographic functions when using Clang compiler. This fixes compilation issues that occur when optimizations are enabled.,"This likely ensures that Bitcoin Core can be built successfully with AddressSanitizer enabled for debugging purposes, which may help developers catch memory-related bugs in other parts of the codebase while working around a specific compiler issue.",utils,bugfix
32439,guix: accomodate migration to codeberg,https://github.com/bitcoin/bitcoin/pull/32439,merged,2025-05-07T16:24:28Z,2025-05-27T17:09:14Z,2025-05-27T17:09:14Z,Build system,Build system,1,5,5,2,7,20,hebasto;maflcko,,Updates the Guix build system configuration to accommodate the migration of the Guix project from its previous hosting platform to Codeberg.,"This appears to be necessary for maintaining the deterministic build system that Bitcoin Core relies on, likely ensuring that developers can continue to create reproducible builds as the upstream Guix project changes infrastructure.",build,bugfix
32444,"doc: swap ""Docker image"" for ""container image""",https://github.com/bitcoin/bitcoin/pull/32444,merged,2025-05-08T09:20:59Z,2025-05-08T12:50:28Z,2025-05-08T12:50:28Z,Docs,Docs,1,5,5,1,0,0,hebasto;laanwj,,"Updates documentation to use the more generic term ""container image"" instead of ""Docker image"" throughout the codebase.","This likely improves documentation accuracy and inclusivity by acknowledging that users may use alternative container runtimes like Podman, potentially making the project more accessible to developers with different tooling preferences.",docs,docs
32445,build: let CMake determine the year,https://github.com/bitcoin/bitcoin/pull/32445,closed,2025-05-08T09:25:44Z,,2025-05-09T11:14:09Z,Build system,Build system,1,1,1,1,4,1,hebasto;laanwj;ryanofsky;w0xlt,,Updates the build system to automatically determine the current year using CMake instead of requiring manual updates.,"This change likely reduces maintenance burden by eliminating the need to manually update year references in the codebase, and may improve build reproducibility by respecting the SOURCE_DATE_EPOCH environment variable for deterministic builds.",build,cleanup
32446,build: simplify *ifaddr handling,https://github.com/bitcoin/bitcoin/pull/32446,merged,2025-05-08T09:59:58Z,2025-05-10T14:50:06Z,2025-05-10T14:50:06Z,Build system,Build system,1,12,21,7,3,2,TheCharlatan;hebasto,,Simplifies network interface address handling in the build system by removing redundant header checks and consolidating defines.,"This appears to streamline the build configuration by removing unnecessary complexity around network interface detection, which may make the build process more reliable and easier to maintain across different platforms.",build,refactor
32448,contrib: remove bdb exception from FORTIFY check,https://github.com/bitcoin/bitcoin/pull/32448,merged,2025-05-08T13:41:00Z,2025-05-08T18:06:50Z,2025-05-08T18:06:50Z,Scripts and tools,,1,1,2,1,0,0,laanwj;pablomartin4btc;theuni,28710,Removes Berkeley DB-related exceptions from security fortification checks since BDB support was previously removed.,"This cleanup likely ensures that security hardening checks are properly applied now that BDB dependencies are gone, potentially improving the overall security posture of Bitcoin Core binaries.",build,cleanup
32450,randomenv: remove some `/proc/` accesses,https://github.com/bitcoin/bitcoin/pull/32450,closed,2025-05-08T17:20:57Z,,2025-10-21T14:32:07Z,Utils/log/libs,Utils/log/libs,1,0,12,1,0,165,,,Removes certain /proc/ filesystem accesses from the random environment data collection to reduce log spam in containerized environments.,"This change may improve user experience in snap packages and similar containerized deployments by eliminating noisy error messages, while likely having minimal impact on entropy collection since it's described as best-effort.",utils,bugfix
32458,guix: move `*-check.py` scripts under contrib/guix/,https://github.com/bitcoin/bitcoin/pull/32458,merged,2025-05-09T12:54:01Z,2025-05-12T18:49:22Z,2025-05-12T18:49:22Z,Build system,Build system,1,9,34,5,0,3,TheCharlatan;hebasto;laanwj,,Relocates binary verification scripts to a more specific directory under contrib/guix/ to clarify their intended usage.,"This organizational change likely helps prevent misuse of release-specific verification tools by general developers, which may reduce confusion and support requests related to these specialized scripts.",build,refactor
32460,fs: remove `_POSIX_C_SOURCE` defining,https://github.com/bitcoin/bitcoin/pull/32460,merged,2025-05-09T15:01:58Z,2025-05-30T09:21:06Z,2025-05-30T09:21:06Z,Utils/log/libs,Utils/log/libs,1,0,18,2,1,20,hebasto;laanwj,,"Removes the manual definition of `_POSIX_C_SOURCE` macro, allowing it to default to a more recent value (200809L) on modern Linux systems.","This change likely helps ensure Bitcoin Core uses more modern POSIX standards by default, which may improve compatibility with newer system libraries and could potentially reduce maintenance burden from manually managing older standard definitions.",build,cleanup
32479,[27.x] Backports,https://github.com/bitcoin/bitcoin/pull/32479,merged,2025-05-13T13:31:40Z,2025-06-09T12:52:21Z,2025-06-09T12:52:21Z,Backport;CI failed,,9,67,32,15,0,26,willcl-ark,32070;32187;32286;32439;32568,Backports multiple previous pull requests to the 27.x release branch for inclusion in a maintenance release.,"This appears to be standard maintenance work to bring important fixes and improvements to the stable 27.x branch, likely helping users on that version receive critical updates without upgrading to newer major versions.",other,bugfix
32480,[28.x] 28.2rc1,https://github.com/bitcoin/bitcoin/pull/32480,merged,2025-05-13T13:44:35Z,2025-05-16T17:09:56Z,2025-05-16T17:09:56Z,Backport;CI failed,,3,28,28,8,0,3,willcl-ark,,Prepares the final changes needed for the 28.2rc1 release candidate on the 28.x branch.,"This likely represents routine release management to ensure the 28.2 release candidate is properly prepared, which may help maintain Bitcoin Core's regular release schedule and provide users with tested updates.",other,docs
