pr_number,title,url,status,created_at,merged_at,closed_at,labels,component,num_commits,additions,deletions,changed_files,review_comments_count,days_open,reviewers,related_issues,summary,potential_rationale,category,change_type
32482,build: add `-W*-whitespace`,https://github.com/bitcoin/bitcoin/pull/32482,merged,2025-05-13T15:13:05Z,2025-11-12T10:53:52Z,2025-11-12T10:53:52Z,Build system,Build system,8,626,615,6,8,182,hebasto;l0rinc,33822,"Adds GCC compiler flags to detect and fail compilation on leading and trailing whitespace issues, while fixing existing whitespace problems in the codebase.","This change likely helps maintain consistent code formatting standards and may reduce development overhead by catching whitespace issues at compile time rather than during code review, potentially improving the efficiency of the development process.",build,cleanup
32484,[28.x] build: suppress `-Wunterminated-string-initialization` in secp256k1,https://github.com/bitcoin/bitcoin/pull/32484,closed,2025-05-13T16:18:38Z,,2025-06-17T15:43:45Z,Backport;CI failed,,1,3,0,1,0,34,hebasto,,Suppresses specific compiler warnings about unterminated string initialization in the secp256k1 library when using GCC 15.,"This appears to be a compatibility fix to ensure Bitcoin Core compiles cleanly with newer GCC versions, which may be important for maintaining buildability across different development environments and preventing false positive warnings that could mask real issues.",build,bugfix
32485,Update minisketch subtree,https://github.com/bitcoin/bitcoin/pull/32485,merged,2025-05-13T17:10:00Z,2025-05-16T09:04:24Z,2025-05-16T09:04:24Z,,,2,4,4,1,0,2,willcl-ark,32482,Updates the minisketch subtree to incorporate recent changes from the upstream minisketch repository. This appears to be a routine maintenance update to keep the subtree synchronized.,"This likely helps maintain Bitcoin Core's compact block relay functionality by ensuring the minisketch library used for set reconciliation stays up-to-date with bug fixes and improvements, which may enhance network efficiency.",other,cleanup
32491,build: document why we check for `std::system`,https://github.com/bitcoin/bitcoin/pull/32491,merged,2025-05-14T08:53:44Z,2025-05-16T10:47:01Z,2025-05-16T10:47:01Z,Build system,Build system,1,2,0,1,0,2,,,Adds documentation explaining why Bitcoin Core's build system checks for the std::system standard library function. This clarifies that the check exists because std::system is not available on certain platforms like iOS.,"This documentation likely helps developers understand build system requirements and platform compatibility constraints, which may assist in maintaining cross-platform support and debugging build issues.",build,docs
32492,test: add skip_if_running_under_valgrind(),https://github.com/bitcoin/bitcoin/pull/32492,merged,2025-05-14T09:58:24Z,2025-05-15T09:17:54Z,2025-05-15T09:17:54Z,Tests,Tests,1,10,0,6,0,0,willcl-ark,32374,Introduces a skip_if_running_under_valgrind() function for tests and enables it in USDT (User Statically Defined Tracing) tests. This prevents test failures when running under Valgrind due to SIGTRAP signal conflicts.,"This likely improves the developer experience by allowing tests to run cleanly under Valgrind memory debugging tools, which may help maintain code quality and make it easier to catch memory-related bugs.",tests,test
32496,depends: drop `ltcg` for Windows Qt,https://github.com/bitcoin/bitcoin/pull/32496,merged,2025-05-14T11:45:50Z,2025-06-05T08:54:13Z,2025-06-05T08:54:14Z,Build system,Build system,1,0,3,1,0,21,,30997,Removes the Link Time Code Generation (LTCG) configuration for Windows Qt builds in the depends system. This change acknowledges that cross-compilation doesn't support Link Time Optimization.,"This likely simplifies the build process and removes unnecessary configuration that wasn't working properly, which may improve build reliability and reduce compilation errors for Windows builds.",build,cleanup
32498,doc: remove Carls substitute server from Guix docs,https://github.com/bitcoin/bitcoin/pull/32498,merged,2025-05-14T14:10:12Z,2025-05-15T08:39:47Z,2025-05-15T08:39:47Z,Docs,Docs,1,5,11,1,0,0,hebasto,,Removes a reference to Carl's substitute server from the Guix documentation because the server no longer exists. Updates the documentation to reference other available Guix servers instead.,"This likely helps developers successfully follow the Guix build instructions by removing outdated server references, which may prevent build failures and confusion when setting up reproducible builds.",docs,docs
32500,init: drop `-upnp`,https://github.com/bitcoin/bitcoin/pull/32500,merged,2025-05-14T15:05:59Z,2025-05-16T08:31:50Z,2025-05-16T08:31:50Z,,,1,3,28,2,0,1,darosior,,Removes the deprecated `-upnp` command line option that was scheduled for removal in version 30.0.,"This likely helps streamline the codebase by removing deprecated functionality, which may reduce maintenance burden and potential confusion for users who might use outdated configuration options.",utils,cleanup
32534,Update leveldb subtree to latest upstream,https://github.com/bitcoin/bitcoin/pull/32534,merged,2025-05-16T15:15:19Z,2025-05-17T08:42:17Z,2025-05-17T08:42:17Z,,,3,13,16,5,0,0,hebasto,,Updates the embedded LevelDB database library to the latest upstream version and removes related compiler warning suppressions.,"This appears to improve Bitcoin Core's database performance and security by incorporating upstream bug fixes and optimizations, while also cleaning up build warnings that may have been addressed in the newer version.",build,feature
32562,doc: remove // for ... comments,https://github.com/bitcoin/bitcoin/pull/32562,merged,2025-05-19T11:41:54Z,2025-05-20T08:28:51Z,2025-05-20T08:28:51Z,Docs,Docs,3,117,92,28,4,0,Sjors;stickies-v;willcl-ark,,Removes outdated 'for loop' comments from the codebase that were providing little value and contained incorrect information.,"This likely improves code maintainability by removing misleading documentation that could confuse developers, and may help reduce noise in code diffs when files are modified.",docs,cleanup
32563,[28.x] Backport #31407,https://github.com/bitcoin/bitcoin/pull/32563,merged,2025-05-19T12:46:23Z,2025-06-05T13:36:25Z,2025-06-05T13:36:25Z,Backport;CI failed,,11,144,75,7,3,17,pinheadmz,31407;32003,Backports changes from PR #31407 and #32003 to the 28.x release branch.,"This appears to bring important fixes or improvements to the stable 28.x branch, likely helping users on that version benefit from bug fixes or security improvements without upgrading to a newer major version.",other,bugfix
32568,"depends: use ""mkdir -p"" when installing xproto",https://github.com/bitcoin/bitcoin/pull/32568,merged,2025-05-20T11:27:14Z,2025-06-03T19:21:24Z,2025-06-03T19:21:24Z,Build system,Build system,1,3,1,1,2,14,hebasto;janb84;willcl-ark,32494,Forces the use of 'mkdir -p' when installing xproto dependency to fix build issues on Alpine Linux systems.,"This likely improves Bitcoin Core's buildability across different operating systems, particularly Alpine Linux, which may help expand the range of environments where Bitcoin Core can be compiled and deployed.",build,bugfix
32584,depends: hard-code necessary c(xx)flags rather than setting them per-host,https://github.com/bitcoin/bitcoin/pull/32584,merged,2025-05-22T09:33:12Z,2025-07-30T20:56:27Z,2025-07-30T20:56:27Z,Build system,Build system,1,16,14,7,0,69,ryanofsky;theuni,31920,Refactors the build system to hard-code necessary compiler flags instead of setting them per-host platform. This removes duplication and ensures critical flags like C++ standard options are always applied regardless of environment variables.,This change likely improves build reliability and consistency across different platforms by ensuring that essential compiler flags are always applied. This may help prevent subtle build issues that could arise when environment variables override necessary compilation settings.,build,refactor
32589,[29.x] More backports,https://github.com/bitcoin/bitcoin/pull/32589,merged,2025-05-22T13:57:32Z,2025-06-25T10:03:10Z,2025-06-25T10:03:10Z,Backport,,22,175,42,31,4,33,glozow;instagibbs;theuni;willcl-ark,31757;32333;32439;32551;32568;32607;32630;32678;32679;32690;32693;32696;32708;32711;32719;32760;32765;32771;32776;32777;32625,A comprehensive backport pull request that brings multiple fixes and improvements from the main branch to the 29.x release branch. This includes 18 different previously merged pull requests.,Backporting fixes to stable release branches likely helps maintain the security and stability of older Bitcoin Core versions that users may still be running. This appears to be routine maintenance that may help ensure critical fixes reach production deployments.,other,bugfix
32639,[28.x] Backport guix: accomodate migration to codeberg,https://github.com/bitcoin/bitcoin/pull/32639,merged,2025-05-29T12:31:58Z,2025-05-30T10:09:30Z,2025-05-30T10:09:30Z,Backport;CI failed,,1,5,5,2,0,0,hebasto,32439,Backports changes to accommodate Guix's migration from their old repository to Codeberg. This updates build tooling to work with the new repository location.,This change likely ensures that Bitcoin Core's deterministic build system continues to work correctly after Guix moved their repository. This may help maintain the reproducible builds that are important for Bitcoin's security model and build verification.,build,bugfix
32644,doc: miscellaneous changes,https://github.com/bitcoin/bitcoin/pull/32644,merged,2025-05-30T10:08:57Z,2025-06-03T08:10:54Z,2025-06-03T08:10:54Z,Docs,Docs,4,42,45,31,2,3,maflcko,32629,Makes various miscellaneous updates to documentation files. This appears to be a collection of small documentation improvements and corrections.,Documentation improvements likely help developers and users better understand Bitcoin Core's functionality and development practices. This may help reduce confusion and improve the overall developer experience when working with the codebase.,docs,docs
32647,build: add -Wthread-safety-pointer,https://github.com/bitcoin/bitcoin/pull/32647,merged,2025-05-30T16:03:12Z,2025-06-04T08:58:09Z,2025-06-04T08:58:09Z,Build system,Build system,3,3,2,2,0,4,theuni,,Adds a new compiler warning flag (-Wthread-safety-pointer) that will be available in Clang 21. This enables warnings when pointers to thread-protected variables are passed as function arguments or return values.,This change likely helps improve thread safety by catching potential issues where protected data might be accessed unsafely through pointers. This may help prevent race conditions and other concurrency bugs that could affect Bitcoin Core's stability and security.,build,feature
32655,depends: sqlite 3.50.4; switch to autosetup,https://github.com/bitcoin/bitcoin/pull/32655,merged,2025-06-01T11:37:10Z,2025-11-25T10:49:32Z,2025-11-25T10:49:32Z,Build system,Build system,2,17,21,2,4,176,hebasto;sedited;willcl-ark,,Updates SQLite dependency to version 3.50.4 and switches from the old build system to the new Autosetup build system.,"This update likely improves build reliability and may provide performance or security benefits from the newer SQLite version, which could enhance wallet database operations and overall node stability.",build,refactor
32656,depends: don't install & then delete sqlite pkgconf,https://github.com/bitcoin/bitcoin/pull/32656,merged,2025-06-01T11:42:24Z,2025-06-02T11:35:03Z,2025-06-02T11:35:03Z,Build system,Build system,1,1,2,1,0,0,hebasto;stickies-v,,Modifies the SQLite build process to avoid installing and then immediately deleting pkgconf files.,This appears to be a build optimization that may reduce build time and complexity by eliminating unnecessary file operations during the SQLite dependency compilation.,build,cleanup
32665,depends: Bump boost to 1.88.0 and use new CMake buildsystem,https://github.com/bitcoin/bitcoin/pull/32665,merged,2025-06-02T16:46:15Z,2025-06-26T13:21:14Z,2025-06-26T13:21:14Z,Build system,Build system,1,161,6,2,6,23,hebasto;theuni;willcl-ark,30434,Updates Boost library to version 1.88.0 and switches to using CMake build system instead of copying headers.,"This modernization likely improves build efficiency and maintainability by using proper CMake integration, which may reduce build times and ensure only necessary components are included, potentially reducing binary size.",build,refactor
32684,[28.x] 28.2rc2,https://github.com/bitcoin/bitcoin/pull/32684,merged,2025-06-05T13:52:05Z,2025-06-09T15:18:33Z,2025-06-09T15:18:34Z,Backport;CI failed,,4,31,22,9,2,4,glozow;willcl-ark,32568;32563;32639,Creates release candidate 2 for Bitcoin Core version 28.2 by backporting recent fixes.,This appears to be part of the release process to ensure the 28.x branch includes important bug fixes and improvements that likely enhance stability and security for users on the stable release branch.,other,feature
32735,[28.x] More backports,https://github.com/bitcoin/bitcoin/pull/32735,merged,2025-06-12T09:45:25Z,2025-06-17T12:11:38Z,2025-06-17T12:11:38Z,Backport;CI failed,,3,39,9,5,0,5,josibake;stickies-v;willcl-ark,32563;32693,Backports additional commits that were missed in previous backport operations to the 28.x release branch.,"This ensures the stable 28.x branch includes all intended fixes and improvements, which likely helps maintain consistency and may address issues that could affect users of the stable release.",other,bugfix
32739,tsan: remove note about dropping Qt wildcards,https://github.com/bitcoin/bitcoin/pull/32739,merged,2025-06-12T16:59:15Z,2025-06-13T13:01:44Z,2025-06-13T13:01:44Z,,,1,1,1,1,0,0,,,"Removes a note about dropping Qt wildcards from ThreadSanitizer configuration, citing maintainability concerns.",This likely helps maintain code clarity by removing documentation that may have become outdated or refers to changes that are impractical to implement in the testing infrastructure.,tests,cleanup
32760,depends: capnp 1.2.0,https://github.com/bitcoin/bitcoin/pull/32760,merged,2025-06-16T10:03:30Z,2025-06-16T16:58:33Z,2025-06-16T16:58:33Z,Build system,Build system,1,2,227,5,0,0,ryanofsky;theStack,,Updates the Cap'n Proto dependency from version 1.1.0 to 1.2.0 in the build system.,"This may help improve build reliability and security by using a newer version of the serialization library, and appears to simplify maintenance by allowing removal of custom patches that were previously needed.",build,feature
32777,doc: fix Transifex 404s,https://github.com/bitcoin/bitcoin/pull/32777,merged,2025-06-19T10:01:55Z,2025-06-19T10:44:00Z,2025-06-19T10:44:00Z,Docs,Docs,1,5,5,4,5,0,fanquake;hebasto,,Fixes broken Transifex links in documentation that now return 404 errors.,This likely helps contributors and translators by ensuring documentation links to translation resources remain accessible and up-to-date.,docs,bugfix
32780,lsan: add more Qt suppressions,https://github.com/bitcoin/bitcoin/pull/32780,merged,2025-06-19T13:18:16Z,2025-06-24T13:08:05Z,2025-06-24T13:08:05Z,,,1,2,0,1,0,4,,0;1;2;3;4;5;6;7;8;9;10;11;12;13;14;15;16;17;18;19;20;0;1;2;3;4;5;6;7;8;9;10;11;12;13;14;15,Adds additional LeakSanitizer suppressions for Qt-related memory leak detection during testing.,"This may help improve the reliability of automated testing by suppressing false positive memory leak reports from Qt GUI components, allowing developers to focus on actual Bitcoin Core memory issues.",tests,cleanup
32797,doc: archive 28.2 release notes,https://github.com/bitcoin/bitcoin/pull/32797,merged,2025-06-23T09:17:38Z,2025-06-23T21:50:47Z,2025-06-23T21:50:47Z,Docs,Docs,1,83,0,1,0,0,glozow,,Archives the release notes for Bitcoin Core version 28.2 now that the version has been officially tagged.,"This likely helps maintain organized documentation structure by moving completed release notes to archives, making it easier for users to find historical version information.",docs,cleanup
32810,[29.x] More backports,https://github.com/bitcoin/bitcoin/pull/32810,merged,2025-06-25T10:41:11Z,2025-07-03T10:57:35Z,2025-07-03T10:57:35Z,Backport,,8,61,7,8,0,8,Ahz9619;hebasto;pinheadmz;willcl-ark,32530;32742;32798;32805;32814;32833;31009,This is a backport PR that brings multiple fixes and improvements from newer versions back to the 29.x branch.,Backports likely help maintain stability and security for users running the 29.x release branch by ensuring important fixes are available without requiring an upgrade to the latest version.,other,bugfix
32811,[28.x] Backports,https://github.com/bitcoin/bitcoin/pull/32811,merged,2025-06-25T10:55:03Z,2025-07-03T16:35:23Z,2025-07-03T16:35:23Z,Backport;CI failed,,5,38,36,7,0,8,hebasto,32678;32765;32776;32777,"This is a backport PR that brings multiple changes from newer versions back to the 28.x branch, though it appears to have CI issues.","This backport may help maintain the 28.x branch with important updates, though the CI failure suggests there could be compatibility issues that need resolution before the changes can be safely applied.",other,bugfix
32837,depends: fix libevent `_WIN32_WINNT` usage,https://github.com/bitcoin/bitcoin/pull/32837,merged,2025-06-30T16:47:03Z,2025-07-16T12:49:31Z,2025-07-16T12:49:31Z,Windows;Build system,Build system,1,125,1,2,3,15,hebasto;theuni;willcl-ark,32707,This fixes how libevent handles Windows version definitions to prevent mingw-w64 header compatibility issues on Windows builds.,"This appears to address a build system issue that likely prevents Bitcoin Core from compiling correctly on Windows systems using newer mingw toolchains, ensuring broader platform compatibility.",build,bugfix
32863,[29.x] Backports,https://github.com/bitcoin/bitcoin/pull/32863,merged,2025-07-03T11:08:23Z,2025-07-18T17:47:34Z,2025-07-18T17:47:34Z,Backport,,15,249,64,21,0,15,glozow;hebasto,32463;32716;32823;32826;32837;32841;32846;32850;32858;32859;32943;32954,This is a comprehensive backport PR that brings twelve different changes and fixes back to the 29.x branch.,This large collection of backports likely helps keep the 29.x branch stable and secure by incorporating important fixes and improvements without requiring users to upgrade to newer major versions.,other,bugfix
32865,cmake: Use `AUTHOR_WARNING` for warnings,https://github.com/bitcoin/bitcoin/pull/32865,closed,2025-07-03T11:21:31Z,,2025-09-01T16:09:18Z,Build system,Build system,1,6,19,3,9,60,hebasto;maflcko;ryanofsky,31476;31665;31669;31476,This changes the CMake build system to use CMake's built-in AUTHOR_WARNING mechanism instead of custom warning handling.,"This change may improve the build system's maintainability and consistency by leveraging standard CMake functionality rather than custom solutions, potentially making it easier for developers to work with the codebase.",build,refactor
32937,Enable `-Werror=dev` in CI & Guix,https://github.com/bitcoin/bitcoin/pull/32937,merged,2025-07-10T11:06:09Z,2025-07-11T22:10:50Z,2025-07-11T22:10:50Z,,,3,5,2,5,0,1,hebasto,32865,"This PR enables the `-Werror=dev` flag in CI and Guix builds, which makes CMake developer warnings into build errors.","This change likely helps improve code quality by catching CMake configuration issues early in development, which may prevent build system problems from reaching users and ensure more consistent builds across different environments.",build,cleanup
32969,[28.x] Backports,https://github.com/bitcoin/bitcoin/pull/32969,merged,2025-07-14T12:41:03Z,2025-07-23T15:54:18Z,2025-07-23T15:54:18Z,Backport;CI failed,,2,3,0,2,0,9,marcofleon,32943,This is a backport PR that brings changes from PR #32943 to the 28.x release branch.,"Backports likely help maintain stability and security in older supported versions of Bitcoin Core, ensuring that important fixes or improvements are available to users who haven't upgraded to the latest version.",other,bugfix
33036,Update secp256k1 subtree to latest master,https://github.com/bitcoin/bitcoin/pull/33036,merged,2025-07-22T08:46:00Z,2025-07-23T08:45:55Z,2025-07-23T08:45:55Z,,,2,281,303,17,0,0,stickies-v;theStack,070,This PR updates the secp256k1 cryptographic library subtree to the latest master version (v0.7.0).,"Updating secp256k1 likely brings performance improvements, bug fixes, or security enhancements to Bitcoin's core cryptographic operations, which may improve transaction verification speed and overall system security.",consensus,feature
33044,contrib: drop use of `PermissionsStartOnly` & `Group=`,https://github.com/bitcoin/bitcoin/pull/33044,merged,2025-07-23T13:35:02Z,2025-08-06T13:50:52Z,2025-08-06T13:50:52Z,Scripts and tools,,2,1,3,1,2,14,willcl-ark,16994;19513,This PR removes deprecated systemd directives (`PermissionsStartOnly` and `Group=`) from Bitcoin Core's service files.,This change likely ensures Bitcoin Core's systemd integration remains compatible with modern Linux distributions and may prevent deprecation warnings or service startup issues on newer systems.,utils,cleanup
33045,"depends: disable variables, rules and suffixes.",https://github.com/bitcoin/bitcoin/pull/33045,merged,2025-07-23T15:24:48Z,2025-11-04T15:02:00Z,2025-11-04T15:02:00Z,Build system,Build system,2,2,0,1,0,103,hebasto,22126,"This PR disables make's builtin variables, rules, and suffixes in the depends build system by adding the `-r` flag.","This change likely makes the build process more predictable and faster by preventing make from searching for builtin rules, which may reduce build times and eliminate potential conflicts with system-specific make configurations.",build,performance
33046,[29.x] test: Do not pass tests on unhandled exceptions,https://github.com/bitcoin/bitcoin/pull/33046,merged,2025-07-23T16:03:10Z,2025-07-24T11:16:00Z,2025-07-24T11:16:00Z,Backport,,3,4,15,2,0,0,marcofleon;pablomartin4btc,33001,This backports a fix to the 29.x branch that prevents tests from incorrectly passing when unhandled exceptions occur.,"This likely improves test reliability by ensuring that unexpected errors are properly caught and reported, which may help prevent bugs from going unnoticed in the stable 29.x release branch.",tests,bugfix
33064,test: fix RPC coverage check,https://github.com/bitcoin/bitcoin/pull/33064,merged,2025-07-25T14:02:51Z,2025-07-28T09:53:11Z,2025-07-28T09:53:11Z,Tests,Tests,2,6,1,3,0,2,cedwies,27593;27593,"This fixes the RPC coverage check in tests, cleaning up and rebasing previous work now that legacy wallet support has been removed.","This appears to improve test coverage validation for RPC methods, which may help ensure that all RPC functionality is properly tested and reduce the risk of regressions in Bitcoin's API.",tests,bugfix
33074,[29.x] Backports,https://github.com/bitcoin/bitcoin/pull/33074,merged,2025-07-28T09:30:49Z,2025-08-15T12:59:13Z,2025-08-15T12:59:13Z,Backport,,8,62,33,10,0,18,glozow,33070;33073;33086;33088;33103;33119;33133,This backports multiple fixes and improvements to the 29.x stable branch.,This likely helps maintain stability and reliability of the 29.x release by incorporating important fixes that may address various issues discovered in the main development branch.,other,bugfix
33076,[28.x] Backports,https://github.com/bitcoin/bitcoin/pull/33076,merged,2025-07-28T09:38:29Z,2025-07-30T14:31:17Z,2025-07-30T14:31:17Z,Backport;CI failed,,5,36,29,6,0,2,marcofleon;willcl-ark,33001;33070;33073,"This backports multiple fixes to the 28.x stable branch, though CI tests have failed.","This appears to be an attempt to improve the stability of the 28.x release branch, though the CI failures may indicate compatibility issues that need to be resolved before these fixes can be safely applied.",other,bugfix
33079,ci: limit max stack size to 512 KiB,https://github.com/bitcoin/bitcoin/pull/33079,merged,2025-07-28T13:38:40Z,2025-07-29T15:17:40Z,2025-07-29T15:17:40Z,Tests,Tests,2,11,2,8,4,1,dergoegge;maflcko,31367;29840,This limits the maximum stack size to 512 KiB in CI testing environments to prevent stack overflow issues.,"This likely helps catch potential stack overflow vulnerabilities during testing, which may improve Bitcoin's security by identifying code paths that use excessive stack space before they reach production.",tests,test
33081,[NO MERGE]: TSAN should fail,https://github.com/bitcoin/bitcoin/pull/33081,closed,2025-07-28T16:12:06Z,,2025-07-29T09:20:32Z,CI failed,,1,1,1,1,0,0,,,A test pull request designed to intentionally fail TSAN (Thread Sanitizer) testing. This appears to be used for testing CI infrastructure rather than actual code changes.,"This likely serves as a testing mechanism to verify that the continuous integration system properly detects and reports thread safety issues, which may help maintain the reliability of Bitcoin Core's automated testing infrastructure.",tests,test
33088,doc: move `cmake -B build -LH` up in Unix build docs,https://github.com/bitcoin/bitcoin/pull/33088,merged,2025-07-29T10:58:55Z,2025-07-29T15:16:23Z,2025-07-29T15:16:23Z,Docs,Docs,1,4,7,1,0,0,janb84;stickies-v,32269,Moves the `cmake -B build -LH` command higher up in the Unix build documentation to make it more prominent for developers.,"This change appears to improve the developer experience by making build configuration options more discoverable early in the process, which may help reduce build-related issues and support requests from contributors.",docs,docs
