pr_number,title,url,status,created_at,merged_at,closed_at,labels,component,num_commits,additions,deletions,changed_files,review_comments_count,days_open,reviewers,related_issues,summary,potential_rationale,category,change_type
33099,ci: allow for any libc++ intrumentation & use it for TSAN,https://github.com/bitcoin/bitcoin/pull/33099,merged,2025-07-30T12:03:46Z,2025-07-31T14:08:21Z,2025-07-31T14:08:21Z,Tests,Tests,3,27,24,5,4,1,dergoegge;maflcko,33087,Modifies the CI system to allow libc++ instrumentation with any sanitizer (not just MemoryWithOrigins) and specifically enables it for TSAN testing.,"This likely improves the effectiveness of thread safety testing by providing better instrumentation coverage, which may help catch more subtle concurrency bugs that could potentially affect Bitcoin Core's reliability in multi-threaded scenarios.",tests,test
33100,ci: remove `ninja-build` from MSAN jobs,https://github.com/bitcoin/bitcoin/pull/33100,merged,2025-07-30T12:13:10Z,2025-07-30T15:23:55Z,2025-07-30T15:23:56Z,Tests,Tests,1,1,2,2,0,0,hebasto,,Removes the redundant `ninja-build` package from MSAN (Memory Sanitizer) CI jobs since it's already included in the base CI packages.,"This appears to be a cleanup that may help streamline the CI setup process and reduce potential conflicts or redundancy in the build environment, likely improving build consistency and maintenance.",tests,cleanup
33111,build: note that sysctl was removed from Linux,https://github.com/bitcoin/bitcoin/pull/33111,closed,2025-08-01T10:07:46Z,,2025-08-13T09:51:29Z,Build system,Build system,1,2,2,1,0,11,janb84,,"Adds documentation noting that the sysctl system call was removed from Linux kernel 5.5, while keeping existing compatibility checks for older kernels.","This likely helps maintainers understand the historical context of certain build checks and may inform future decisions about when to drop legacy kernel support, potentially affecting Bitcoin Core's platform compatibility strategy.",build,docs
33125,ci: Use mlc `v1` and fix typos,https://github.com/bitcoin/bitcoin/pull/33125,merged,2025-08-02T11:22:56Z,2025-08-07T10:57:44Z,2025-08-07T10:57:44Z,Tests,Tests,6,10,10,6,4,4,maflcko,,"Updates CI tooling versions (mlc to v1, shellcheck to 0.11.0) and fixes various typos found during linting.",Keeping CI tools up-to-date likely helps catch more issues during development and may improve code quality by using newer linting capabilities. Fixing typos appears to improve overall code documentation quality.,tests,cleanup
33143,[28.x] Backports,https://github.com/bitcoin/bitcoin/pull/33143,merged,2025-08-06T11:16:25Z,2025-08-15T16:14:24Z,2025-08-15T16:14:24Z,Backport;CI failed,,2,6,5,2,0,9,willcl-ark,33133,Backports changes from PR #33133 to the 28.x release branch.,"Backporting appears to bring important fixes or improvements to the stable release branch, which may help maintain stability and consistency across Bitcoin Core versions.",other,bugfix
33151,subtree: update crc32c subtree,https://github.com/bitcoin/bitcoin/pull/33151,merged,2025-08-07T08:35:20Z,2025-08-07T11:59:50Z,2025-08-07T11:59:50Z,,,2,111,117,7,0,0,janb84,33057,"Updates the crc32c subtree to sync with the latest upstream version, including no-op changes and typo fixes.","Keeping subtree dependencies current likely helps maintain security and compatibility, while the typo fixes may improve code readability and documentation quality.",build,cleanup
33155,contrib: drop `bitcoin-util` exception from FORTIFY check,https://github.com/bitcoin/bitcoin/pull/33155,merged,2025-08-08T09:29:19Z,2025-08-11T09:12:51Z,2025-08-11T09:12:51Z,Scripts and tools,,1,0,3,1,0,2,hebasto,,Removes the bitcoin-util exception from FORTIFY checking since it now includes memcpy_chk protection.,"This change likely strengthens security by ensuring bitcoin-util gets the same buffer overflow protection as other components, which may help prevent potential memory corruption vulnerabilities.",utils,cleanup
33158,macdeploy: avoid use of `Bitcoin Core` in Linux cross build,https://github.com/bitcoin/bitcoin/pull/33158,merged,2025-08-08T16:26:41Z,2025-09-24T13:59:53Z,2025-09-24T13:59:53Z,,,2,18,18,3,2,46,hodlinator;jonatack;willcl-ark,,Changes macOS build output filename to bitcoin-macos-app.zip to avoid using 'Bitcoin Core' in Linux cross builds.,This appears to standardize naming conventions across different platform builds and may help avoid potential trademark or branding issues when building on different systems.,build,cleanup
33178,guix: increase maximum allowed (runtime) GCC to 7,https://github.com/bitcoin/bitcoin/pull/33178,merged,2025-08-12T13:48:02Z,2025-08-13T08:14:11Z,2025-08-13T08:14:11Z,Build system,Build system,1,1,1,1,0,0,hebasto,32750;33177,Updates the Guix build system to allow GCC version 7 as the maximum runtime version to fix symbol compatibility errors. This addresses build failures where newer GCC symbols were being used but not properly supported.,This likely ensures that Bitcoin Core binaries can run on a wider range of Linux distributions by avoiding compatibility issues with newer GCC runtime libraries that may not be available on older systems.,build,bugfix
33180,ASAN: turn on more not-enabled-by-default options,https://github.com/bitcoin/bitcoin/pull/33180,closed,2025-08-13T09:48:44Z,,2025-10-21T14:32:30Z,,,2,2,2,2,1,69,stickies-v,,"Enables additional AddressSanitizer (ASAN) options for stricter memory debugging, including null-termination checks for strings and detection of invalid pointer operations. These options are not enabled by default in ASAN.","This may help catch more subtle memory-related bugs during development and testing, potentially improving Bitcoin Core's overall stability and security by detecting issues that standard ASAN might miss.",tests,test
33181,guix: build for Linux HOSTS with `-static-libgcc`,https://github.com/bitcoin/bitcoin/pull/33181,merged,2025-08-13T10:13:10Z,2025-11-11T11:09:33Z,2025-11-11T11:09:33Z,Build system,Build system,3,24,17,4,5,90,hebasto;janb84;theuni;willcl-ark,,"Modifies the Guix build system to compile Linux binaries with the `-static-libgcc` flag, which statically links the GCC runtime library. This prevents runtime dependency issues with different GCC versions.","This appears to provide a more robust solution to GCC compatibility issues by eliminating runtime dependencies on specific GCC library versions, likely improving Bitcoin Core's portability across different Linux distributions.",build,feature
33185,guix: update time-machine to 5cb84f2013c5b1e48a7d0e617032266f1e6059e2,https://github.com/bitcoin/bitcoin/pull/33185,merged,2025-08-13T16:00:17Z,2025-10-28T10:59:59Z,2025-10-28T10:59:59Z,Build system,Build system,5,68,11,6,9,75,hebasto;maflcko;willcl-ark,32764,"Updates the Guix time-machine commit to a newer version, bringing access to updated packages including LLVM 19 and newer versions of core system libraries like glibc and binutils. This modernizes the build toolchain while maintaining reproducible builds.","This likely improves Bitcoin Core's build infrastructure by providing access to newer development tools and libraries, which may offer better performance, security fixes, and compatibility with modern systems.",build,feature
33217,depends: remove xinerama extension from libxcb,https://github.com/bitcoin/bitcoin/pull/33217,merged,2025-08-19T17:29:40Z,2025-08-22T10:07:00Z,2025-08-22T10:07:00Z,Build system,Build system,2,1,2,2,0,2,hebasto,33197,"Removes the Xinerama extension dependency from libxcb in the build dependencies, as it's only recommended by Qt and primarily used for multi-screen window management. This simplifies installation requirements for users.","This may reduce build complexity and user frustration by eliminating a dependency that's not essential for Bitcoin Core's core functionality, particularly since modern Linux distributions don't install Xinerama by default.",build,cleanup
33225,[29.x] Backport logging ratelimiting,https://github.com/bitcoin/bitcoin/pull/33225,merged,2025-08-20T11:15:55Z,2025-08-20T13:54:39Z,2025-08-20T13:54:39Z,Backport,,17,512,89,10,7,0,dergoegge;fanquake;stickies-v,32604;33011;33211,"Backports logging rate limiting functionality to the 29.x branch, which likely helps prevent log spam during high-activity periods. Includes multiple related PRs for comprehensive logging improvements.","Rate limiting logging may help prevent disk space issues and performance degradation that could occur when Bitcoin Core generates excessive log output during network stress, IBD, or attack scenarios.",other,feature
33234,doc: update example bitcoin conf for 29.1rc2,https://github.com/bitcoin/bitcoin/pull/33234,merged,2025-08-21T11:20:06Z,2025-08-21T14:03:25Z,2025-08-21T14:03:25Z,Backport,,1,2,2,1,0,0,dergoegge;willcl-ark,33226,Updates the example Bitcoin configuration file documentation for the 29.1rc2 release. This is a follow-up to a previous documentation update.,"Keeping example configurations current likely helps users properly configure their Bitcoin nodes, which may reduce support burden and improve network stability through better node operation.",docs,docs
33235,build: set ENABLE_IPC to OFF when fuzzing,https://github.com/bitcoin/bitcoin/pull/33235,merged,2025-08-21T11:28:45Z,2025-09-04T09:07:11Z,2025-09-04T09:07:11Z,Build system,Build system,1,1,0,1,0,13,dergoegge;janb84,,"Fixes build configuration by disabling IPC when building for fuzzing, addressing a failure where the capnp dependency was missing during fuzzing builds.","This appears to improve the fuzzing build process, which may help developers more easily run security testing that could identify potential vulnerabilities or crash scenarios in Bitcoin Core.",build,bugfix
33238,[29.x] depends: remove xinerama extension from libxcb,https://github.com/bitcoin/bitcoin/pull/33238,closed,2025-08-22T11:47:06Z,,2025-09-01T15:04:56Z,Backport;CI failed,,3,2,2,3,0,10,,33217;33217,Backports the removal of the obsolete xinerama extension from libxcb dependency to the 29.x branch. The xinerama extension was deprecated well before Qt6.,"Removing obsolete dependencies likely reduces the build complexity and potential security surface area, while ensuring compatibility with newer Qt versions that Bitcoin's GUI may eventually adopt.",build,cleanup
33258,ci: use LLVM 21,https://github.com/bitcoin/bitcoin/pull/33258,merged,2025-08-26T16:43:49Z,2025-08-28T18:45:10Z,2025-08-28T18:45:11Z,Tests,Tests,1,5,5,5,0,2,janb84;l0rinc,,"Updates the continuous integration system to use LLVM version 21 for sanitizer and fuzzing builds, upgrading from a previous version.","Using newer LLVM versions may help catch more potential bugs, memory issues, or security vulnerabilities through improved static analysis and sanitizer capabilities during automated testing.",tests,test
33261,ci: return to using dash in CentOS job,https://github.com/bitcoin/bitcoin/pull/33261,merged,2025-08-27T10:11:22Z,2025-08-28T18:28:15Z,2025-08-28T18:28:15Z,Tests,Tests,1,2,2,2,2,1,janb84;maflcko,,Updates the CentOS continuous integration job to use the dash shell again after it became available following a bug fix.,"This change likely helps maintain consistency in testing environments and may ensure that Bitcoin Core's shell scripts are properly tested across different shell implementations, which could help catch compatibility issues early.",tests,bugfix
33271,[29.x] finalise v29.1,https://github.com/bitcoin/bitcoin/pull/33271,merged,2025-08-29T15:34:09Z,2025-09-03T14:49:52Z,2025-09-03T14:49:52Z,Backport,,5,51,48,13,1,4,Ystel2001;glozow;stickies-v;willcl-ark,33236;33261;33212;33251,Finalizes version 29.1 by backporting several pull requests including the dash CI fix and other changes.,"This appears to be preparing a stable release by incorporating important fixes and updates, which likely helps ensure users have access to a more reliable and tested version of Bitcoin Core.",other,feature
33274,kernel: chainparams & headersync updates for 30.0,https://github.com/bitcoin/bitcoin/pull/33274,merged,2025-09-01T13:31:52Z,2025-09-03T10:08:44Z,2025-09-03T10:08:44Z,Validation,Validation,6,46,35,3,23,1,Sjors;achow101;darosior;hodlinator;w0xlt,,"Updates chain parameters and header synchronization logic for version 30.0, including new assumeutxo parameters for mainnet and testnet4.","These changes likely help improve initial blockchain synchronization performance through assumeutxo functionality, which may significantly reduce the time needed for new nodes to become operational while maintaining security assumptions.",validation,feature
33283,contrib: update fixed seeds,https://github.com/bitcoin/bitcoin/pull/33283,merged,2025-09-02T13:50:22Z,2025-09-08T09:32:59Z,2025-09-08T09:32:59Z,Scripts and tools,,3,1947,4398,7,0,5,dergoegge;marcofleon,,Updates the hardcoded list of seed nodes that Bitcoin Core uses for initial peer discovery before the 30.0 release.,"This change likely helps ensure new Bitcoin Core nodes can reliably find initial peers to connect to the network, which may improve network connectivity and reduce bootstrapping failures for new installations.",p2p,cleanup
33294,[29.x] *san CI backports,https://github.com/bitcoin/bitcoin/pull/33294,merged,2025-09-03T15:45:11Z,2025-09-08T16:17:04Z,2025-09-08T16:17:04Z,Backport,,6,57,217,8,0,5,marcofleon,32999;33099;33258,"Backports several sanitizer-related continuous integration improvements to the 29.x branch, including build system updates.","These backports likely help improve code quality testing in the stable branch by enhancing memory and undefined behavior detection during CI runs, which may help catch potential security issues or bugs before release.",tests,test
33304,depends: strip when installing qt binaries,https://github.com/bitcoin/bitcoin/pull/33304,merged,2025-09-04T12:51:06Z,2025-09-05T09:14:54Z,2025-09-05T09:14:54Z,Build system,Build system,1,2,2,2,0,0,TheCharlatan;hebasto,33293,"Reduces the size of Qt binaries in the build system by stripping debug symbols when installing, reducing storage from ~1.5GB in debug builds.","This change likely helps improve CI efficiency and reduces storage requirements for developers, which may indirectly benefit Bitcoin development by making builds faster and less resource-intensive.",build,performance
33308,doc: fix `LIBRARY_PATH` comment,https://github.com/bitcoin/bitcoin/pull/33308,merged,2025-09-04T16:33:35Z,2025-09-08T13:31:21Z,2025-09-08T13:31:21Z,Docs,Docs,1,1,1,1,3,3,hebasto;l0rinc;willcl-ark,,Updates a documentation comment about LIBRARY_PATH to reflect that capnp is now built in addition to Qt as a native package.,This appears to be a minor documentation accuracy improvement that may help developers better understand the build dependencies and configuration.,docs,docs
33339,doc: move release notes to wiki pre branch off,https://github.com/bitcoin/bitcoin/pull/33339,merged,2025-09-08T11:10:31Z,2025-09-08T12:41:59Z,2025-09-08T12:41:59Z,Docs,Docs,1,0,206,24,0,0,janb84;willcl-ark,,"Moves release notes to the wiki before branching off, directing users to the v30.0 Release Notes Draft on the Bitcoin Core dev wiki.","This likely helps streamline the release process and may improve coordination of release documentation, potentially making releases more organized and accessible to users.",docs,docs
33342,guix: strip binaries in libexec,https://github.com/bitcoin/bitcoin/pull/33342,merged,2025-09-08T15:26:50Z,2025-09-09T00:24:16Z,2025-09-09T00:24:16Z,Build system,Build system,1,1,1,1,0,0,hebasto;ryanofsky,31679,Updates the Guix build system to strip debug symbols from binaries that were moved to the libexec/ directory in a previous PR.,"This change likely reduces the size of distributed Bitcoin Core binaries and may improve installation efficiency, which could benefit end users by reducing download times and storage requirements.",build,bugfix
33344,[29.x] Backports,https://github.com/bitcoin/bitcoin/pull/33344,merged,2025-09-09T09:19:04Z,2025-09-17T18:00:21Z,2025-09-17T18:00:21Z,Backport,,11,158,106,20,0,8,darosior;mzumsande,32646;33296;33310;33340;33364;33395,Backports multiple previous pull requests to the 29.x branch and includes changes for the 29.2rc1 release candidate.,"This appears to bring important fixes and improvements to the stable 29.x release branch, which likely helps maintain stability and security for users running the 29.x version series.",other,bugfix
33346,doc: remove release note fragment,https://github.com/bitcoin/bitcoin/pull/33346,merged,2025-09-09T09:44:02Z,2025-09-09T09:47:30Z,2025-09-09T09:47:30Z,Docs,Docs,1,0,4,1,0,0,dergoegge,,Removes a release note fragment file since the content has been moved to the v30.0 release notes draft on the developer wiki.,"This likely helps maintain clean documentation by removing redundant files after consolidating release notes, which may improve the development workflow and reduce confusion about where official release information is located.",docs,cleanup
33347,build: bump `CLIENT_VERSION_MAJOR` to 30,https://github.com/bitcoin/bitcoin/pull/33347,merged,2025-09-09T10:00:04Z,2025-09-09T10:14:59Z,2025-09-09T10:14:59Z,Build system,Build system,1,1,1,1,0,0,hebasto,,Updates the major client version number to 30 in the build system configuration.,"This appears to be a critical step in the release process that ensures Bitcoin Core will identify itself as version 30.x, which may be necessary for proper network compatibility and version signaling to other nodes.",build,feature
33348,contrib: add bitcoin binary to gen-manpages,https://github.com/bitcoin/bitcoin/pull/33348,merged,2025-09-09T10:30:27Z,2025-09-09T10:54:06Z,2025-09-09T10:54:06Z,Scripts and tools,,2,6,0,2,0,0,dergoegge,31375,"Adds the bitcoin binary to the manual page generation script, fixing an omission from a previous change.","This likely ensures that comprehensive documentation is generated for all Bitcoin Core binaries, which may help users and system administrators properly understand and configure the software.",utils,bugfix
33349,[30.x] v30.0rc1,https://github.com/bitcoin/bitcoin/pull/33349,merged,2025-09-09T10:32:56Z,2025-09-09T12:21:26Z,2025-09-09T12:21:26Z,Backport,,5,2992,121,12,0,0,hebasto;janb84;stickies-v,33348,"Creates the first release candidate for Bitcoin Core v30.0, including version bumps, configuration file generation, manual pages, and release notes linking.","This appears to be a milestone release preparation that may enable broader testing of new features and improvements before the final v30.0 release, potentially helping to identify issues before widespread deployment.",build,feature
33356,[30.0] rc2 backports,https://github.com/bitcoin/bitcoin/pull/33356,merged,2025-09-10T11:44:33Z,2025-09-17T18:02:01Z,2025-09-17T18:02:02Z,Backport,,15,299,20,22,0,7,darosior;hebasto,33243;33268;33310;33364;33379;33380;33391;33395;33407,Backports multiple fixes and improvements to the v30.0 release branch for the second release candidate.,"This likely incorporates important bug fixes and stability improvements into the release candidate, which may help ensure the final v30.0 release is more robust and addresses issues discovered during testing.",other,bugfix
33364,ci: always use tag for LLVM checkout,https://github.com/bitcoin/bitcoin/pull/33364,merged,2025-09-11T09:56:27Z,2025-09-12T08:46:30Z,2025-09-12T08:46:30Z,Tests,Tests,1,2,3,1,0,0,willcl-ark,33345,Changes the continuous integration system to use a fixed LLVM tag instead of trying to match the apt-installed clang version. This addresses intermittent issues with version matching.,This change likely improves the reliability and reproducibility of Bitcoin Core's automated testing infrastructure by eliminating version mismatch issues that could cause CI failures or inconsistent test results.,tests,bugfix
33373,depends: systemtap 5.3,https://github.com/bitcoin/bitcoin/pull/33373,merged,2025-09-12T11:01:41Z,2025-09-16T10:21:01Z,2025-09-16T10:21:01Z,Build system,Build system,1,2,2,1,0,3,0xB10C,,"Updates systemtap dependency to version 5.3, which includes a fix to properly check if __STDC_VERSION__ is defined before using it in a comparison.","This update may help prevent compilation errors or undefined behavior when building Bitcoin Core with certain compiler configurations that don't define __STDC_VERSION__, improving build compatibility across different environments.",build,bugfix
33411,ci: re-add Valgrind job to the CI,https://github.com/bitcoin/bitcoin/pull/33411,closed,2025-09-17T09:26:38Z,,2025-10-21T14:33:51Z,Tests,Tests,1,6,0,1,3,34,maflcko,,Re-adds Valgrind memory debugging tool to the main continuous integration pipeline after the migration to a new CI setup. Valgrind helps detect memory-related bugs.,"This change likely enhances Bitcoin Core's code quality assurance by automatically detecting memory leaks, buffer overflows, and other memory-related issues that could potentially lead to security vulnerabilities or crashes in production.",tests,test
33415,[28.x] More backports,https://github.com/bitcoin/bitcoin/pull/33415,merged,2025-09-17T11:09:02Z,2025-09-25T20:41:31Z,2025-09-25T20:41:31Z,Backport,,4,48,35,7,3,8,achow101;glozow;willcl-ark,33236;33340;33395,"Backports multiple previously merged pull requests (#33236, #33340, #33395) to the 28.x release branch for inclusion in maintenance releases.","These backports likely bring important bug fixes or improvements to the stable 28.x release branch, helping users on that version receive critical updates without needing to upgrade to a newer major version.",other,bugfix
33416,[27.x] Backports,https://github.com/bitcoin/bitcoin/pull/33416,merged,2025-09-17T14:34:53Z,2025-10-13T11:21:13Z,2025-10-13T11:21:13Z,Backport;CI failed,,3,57,5,5,0,25,marcofleon;willcl-ark,30198;33395,Backports selected changes from pull requests #30198 (partial) and #33395 to the 27.x release branch for inclusion in maintenance releases.,"These backports appear to bring essential fixes to the older 27.x release branch, likely addressing security issues or critical bugs that users on this stable version need without requiring a major version upgrade.",other,bugfix
33424,[30.0] Final changes + rc2,https://github.com/bitcoin/bitcoin/pull/33424,merged,2025-09-18T10:00:56Z,2025-09-23T22:46:30Z,2025-09-23T22:46:30Z,Backport,,13,203,64,24,0,5,hebasto;willcl-ark,28592;33302;33333;33420;33422;33425;33435;33459,This PR finalizes Bitcoin Core v30.0 release candidate 2 by backporting multiple changes from the development branch. It represents the preparation work for making rc2 available for testing.,"This likely helps ensure Bitcoin Core v30.0 has critical fixes and improvements incorporated before the final release, which may improve stability and reduce the need for emergency patches after release.",other,feature
33425,ci: remove Clang build from msan fuzz job,https://github.com/bitcoin/bitcoin/pull/33425,merged,2025-09-18T11:17:14Z,2025-09-23T14:10:02Z,2025-09-23T14:10:02Z,Tests,Tests,1,4,18,2,3,5,Sjors,,This PR modifies the continuous integration setup by removing the Clang build from the memory sanitizer (msan) fuzz testing job and instead using apt-installed LLVM/Clang. It simplifies the build process by linking against the standard C++ library.,"This change likely improves CI efficiency by reducing build complexity while maintaining fuzz testing coverage, which may help catch memory-related bugs more quickly and with fewer resource requirements.",tests,cleanup
33428,depends: Boost 1.90.0,https://github.com/bitcoin/bitcoin/pull/33428,merged,2025-09-18T16:48:41Z,2026-01-09T22:24:25Z,2026-01-09T22:24:25Z,Build system,Build system,1,2,143,2,0,113,hebasto;sedited,,This PR updates the Boost library dependency from an earlier version to version 1.90.0 in the depends system. It ensures Bitcoin Core uses a more recent version of this critical C++ library.,"This update likely brings performance improvements, bug fixes, and potentially new features from the newer Boost version, which may enhance Bitcoin Core's reliability and efficiency in areas that rely on Boost libraries.",build,feature
33434,depends: static libxcb-cursor,https://github.com/bitcoin/bitcoin/pull/33434,merged,2025-09-19T12:50:13Z,2025-10-03T14:26:26Z,2025-10-03T14:26:26Z,Build system,Build system,1,1,8,3,2,14,hebasto;willcl-ark,33432;32097,This PR makes libxcb-cursor statically linked in the depends system to remove the runtime requirement for this library. It addresses compatibility issues with modern Ubuntu systems where this library is no longer present by default.,"This change likely improves Bitcoin Core's portability and reduces installation friction on newer Linux distributions, which may make it easier for users to run Bitcoin Core without encountering missing dependency errors.",build,bugfix
33436,ci: run s390x job,https://github.com/bitcoin/bitcoin/pull/33436,closed,2025-09-19T13:40:38Z,,2025-10-15T14:58:37Z,Tests;Needs rebase,Tests,3,16,0,3,1,26,maflcko,,"This PR enables the s390x architecture job in the continuous integration pipeline. It appears to be testing how quickly this job runs, possibly as part of evaluating whether to include it regularly.","This likely expands Bitcoin Core's testing coverage to include the s390x architecture (IBM mainframes), which may help ensure compatibility and catch architecture-specific bugs on enterprise systems that might run Bitcoin infrastructure.",tests,test
