pr_number,title,url,status,created_at,merged_at,closed_at,labels,component,num_commits,additions,deletions,changed_files,review_comments_count,days_open,reviewers,related_issues,summary,potential_rationale,category,change_type
32266,"depends: Avoid `warning: ""_FORTIFY_SOURCE"" redefined` for `libevent`",https://github.com/bitcoin/bitcoin/pull/32266,merged,2025-04-14T15:23:14Z,2025-10-23T07:45:33Z,2025-10-23T07:45:34Z,Build system,Build system,1,1,1,1,0,191,shahsb;theuni,,Fixes compiler warnings about redefined _FORTIFY_SOURCE when building the libevent dependency on Alpine Linux.,This likely improves build reliability on Alpine Linux by eliminating compiler warnings that could potentially mask real issues or cause build failures in stricter compilation environments.,build,bugfix
32287,build: Fix `macdeployqtplus` after switching to Qt 6,https://github.com/bitcoin/bitcoin/pull/32287,merged,2025-04-16T12:39:33Z,2025-05-06T17:10:28Z,2025-05-06T17:10:28Z,macOS;Build system;Tests,Build system,3,11,10,2,4,20,fanquake;i-am-yuvi,,Fixes the macdeployqtplus script to work properly with Qt 6 on macOS by handling differences in library path references compared to Qt 5.,"This likely helps maintain the ability to build Bitcoin Core GUI applications on macOS as the project transitions to newer Qt versions, which may be important for keeping the software accessible to Mac users and maintaining cross-platform compatibility.",build,bugfix
32289,doc: Add note for building on macOS (Intel) with CMake ≥ 4.0,https://github.com/bitcoin/bitcoin/pull/32289,closed,2025-04-16T16:23:00Z,,2025-07-02T13:35:59Z,Docs;macOS,Docs,1,2,0,1,2,76,fanquake,,Adds documentation notes for building Bitcoin Core on Intel-based macOS systems when using CMake version 4.0 or later to address warning suppression issues.,"This appears to help developers avoid build warnings that could potentially mask real issues, and may improve the overall developer experience when building Bitcoin Core on macOS Intel systems with newer CMake versions.",docs,docs
32306,ci: Temporarily disable `WalletMigration` benchmark,https://github.com/bitcoin/bitcoin/pull/32306,merged,2025-04-18T21:47:31Z,2025-04-19T11:56:23Z,2025-04-19T11:56:23Z,Wallet;Tests,Wallet,1,2,1,1,3,0,TheCharlatan;l0rinc,,Temporarily disables the WalletMigration benchmark test that is currently failing in the continuous integration system.,"This likely helps maintain CI stability by preventing build failures, which may be important for keeping the development workflow smooth while the underlying benchmark issue gets resolved properly.",tests,test
32308,ci: Drop no longer necessary `-Wno-error=array-bounds`,https://github.com/bitcoin/bitcoin/pull/32308,merged,2025-04-19T08:05:05Z,2025-04-22T12:13:19Z,2025-04-22T12:13:19Z,Windows;Tests,Tests,1,1,1,1,0,3,TheCharlatan,,Removes the unnecessary `-Wno-error=array-bounds` compiler flag from the Windows cross-compilation CI job since the warnings it was suppressing no longer appear.,"This appears to improve code quality by allowing the compiler to catch potential array bounds issues that could lead to security vulnerabilities or crashes, and may help maintain cleaner build configurations.",build,cleanup
32324,test: Treat executable paths in tests consistently,https://github.com/bitcoin/bitcoin/pull/32324,closed,2025-04-22T10:49:33Z,,2025-06-18T15:43:04Z,Build system;Tests,Build system,1,3,1,2,0,57,janb84,,"Makes the handling of executable paths in tests more consistent, particularly for multi-config CMake generators that use per-configuration subdirectories.","This likely improves the reliability of the test suite across different build configurations, which may be important for ensuring Bitcoin Core works correctly regardless of how it's built and tested by developers.",tests,refactor
32349,"test: Increase stack size for ""Debug"" builds with MSVC",https://github.com/bitcoin/bitcoin/pull/32349,closed,2025-04-25T12:42:34Z,,2025-04-27T09:19:09Z,Windows;Tests,Tests,1,5,0,1,2,1,fanquake,,Increases stack size for Debug builds with MSVC compiler to handle deep recursion in miniscript test functions.,"This likely helps ensure Bitcoin's miniscript testing can run properly on Windows development environments, which may be important for maintaining cross-platform compatibility and allowing developers on Windows to contribute effectively.",tests,bugfix
32352,[29.x] qt: 29.1 translations update,https://github.com/bitcoin/bitcoin/pull/32352,merged,2025-04-25T14:21:58Z,2025-05-06T17:03:08Z,2025-05-06T17:03:08Z,Backport,,1,3501,10706,36,8,11,laanwj,,Updates translations for Bitcoin Core version 29.1 by fetching recent changes from Transifex translation platform.,"This appears to improve Bitcoin Core's accessibility to non-English speaking users, which may help with global adoption and usability by providing up-to-date localized interfaces.",gui,feature
32356,cmake: Respect user-provided configuration-specific flags,https://github.com/bitcoin/bitcoin/pull/32356,merged,2025-04-26T11:46:04Z,2025-05-08T15:06:21Z,2025-05-08T15:06:21Z,Bug;Build system,Build system,1,11,8,2,10,12,janb84;purpleKarrot;ryanofsky,,Fixes CMake build system to properly respect user-provided compiler flags for specific build configurations like Release mode.,"This likely helps developers and packagers who need specific compiler optimizations or flags, which may be important for performance tuning or meeting distribution requirements for Bitcoin Core builds.",build,bugfix
32357,depends: Fix cross-compiling `qt` package from macOS to Windows,https://github.com/bitcoin/bitcoin/pull/32357,merged,2025-04-26T17:03:05Z,2025-04-28T15:15:21Z,2025-04-28T15:15:21Z,Build system,Build system,1,8,0,1,0,1,fanquake;shahsb,,Fixes cross-compilation issues when building the Qt package from macOS to Windows by disabling unnecessary Qt behavior.,"This appears to improve the cross-platform build process, which may help developers create Windows binaries from macOS systems more reliably, potentially streamlining release processes and development workflows.",build,bugfix
32358,subprocess: Backport upstream changes,https://github.com/bitcoin/bitcoin/pull/32358,merged,2025-04-27T16:21:44Z,2025-05-05T11:36:03Z,2025-05-05T11:36:04Z,Upstream,,9,82,46,1,0,7,laanwj;theStack,,Backports upstream improvements to the subprocess utility header that were previously developed for Bitcoin Core and contributed back to the original project.,"This likely improves the reliability and functionality of Bitcoin Core's subprocess handling utilities, which may help with various internal processes and external tool integration that Bitcoin Core relies on.",utils,refactor
32367,cmake: Check user-defined `APPEND_*FLAGS` variables early,https://github.com/bitcoin/bitcoin/pull/32367,open,2025-04-28T16:35:27Z,,,Build system,Build system,3,61,25,4,0,,BrandonOdiwuor;janb84,,Fixes the build system to properly handle user-defined compiler flags during early build checks. This ensures that custom flags are consistently applied throughout the entire build process.,"This change likely improves the reliability of Bitcoin Core builds across different environments and configurations, which may help reduce build failures and support issues that could affect developer productivity and software distribution.",build,bugfix
32380,Modernize use of UTF-8 in Windows code,https://github.com/bitcoin/bitcoin/pull/32380,merged,2025-04-29T16:55:29Z,2025-10-28T22:41:55Z,2025-10-28T22:41:55Z,Windows,,5,27,80,16,20,182,davidgumberg;fanquake;hodlinator;laanwj,,Updates Windows code to use modern UTF-8 handling approaches and removes deprecated code that will be removed in C++26. This modernizes how Bitcoin Core handles Unicode text on Windows systems.,"This change appears to future-proof Bitcoin Core's Windows compatibility and may improve handling of non-English characters in file paths and user interfaces, potentially making the software more accessible to international users.",utils,refactor
32383,util: Remove `fsbridge::get_filesystem_error_message()`,https://github.com/bitcoin/bitcoin/pull/32383,merged,2025-04-30T00:18:29Z,2025-04-30T17:56:26Z,2025-04-30T17:56:26Z,Utils/log/libs,Utils/log/libs,1,6,24,7,7,0,davidgumberg;laanwj;maflcko,,Removes the `fsbridge::get_filesystem_error_message()` function which is no longer needed after migrating to std::filesystem and fixes UTF-8 path display issues on Windows.,"This cleanup likely simplifies the codebase and may improve error message clarity for Windows users, potentially making troubleshooting filesystem-related issues easier for both users and developers.",utils,cleanup
32396,cmake: Add application manifests when cross-compiling for Windows,https://github.com/bitcoin/bitcoin/pull/32396,merged,2025-05-01T15:28:35Z,2025-05-16T08:19:18Z,2025-05-16T08:19:18Z,Windows;Build system,Build system,3,74,2,8,24,14,davidgumberg;fanquake;hodlinator;laanwj,,"Adds Windows application manifests during cross-compilation, which enables enhanced security settings and better control over Windows version compatibility.","This change likely improves Bitcoin Core's security posture on Windows and may help ensure proper compatibility across different Windows versions, potentially reducing runtime issues and improving the overall user experience on Windows systems.",build,feature
32409,test: Introduce `SUPPRESS_ABORT_MESSAGE` environment variable,https://github.com/bitcoin/bitcoin/pull/32409,open,2025-05-02T19:45:20Z,,,Windows;Tests,Tests,1,17,0,1,6,,fanquake;maflcko;shahsb,,Introduces an environment variable to suppress abort message boxes when running tests on Windows with debug runtime libraries. This prevents test timeouts caused by modal dialogs in CI environments.,"This change likely improves the reliability of automated testing on Windows, which may help maintain code quality and reduce false positives in continuous integration, ultimately supporting more stable Bitcoin Core development processes.",tests,test
32469,cmake: Allow `WITH_DBUS` on all Unix-like systems,https://github.com/bitcoin/bitcoin/pull/32469,merged,2025-05-11T16:10:57Z,2025-05-12T13:23:00Z,2025-05-12T13:23:00Z,Build system,Build system,1,2,2,1,0,0,theStack,,Extends D-Bus support configuration option to all Unix-like systems instead of restricting it to Linux only. This fixes a regression introduced during the migration from Autotools to CMake build system.,"This change likely improves build system flexibility and may help developers on various Unix-like platforms configure Bitcoin Core with D-Bus support if needed, though the practical impact appears limited since macOS uses different notification systems.",build,bugfix
32472,doc: Fix typo,https://github.com/bitcoin/bitcoin/pull/32472,merged,2025-05-12T16:12:10Z,2025-05-12T18:48:52Z,2025-05-12T18:48:52Z,Docs,Docs,1,2,2,2,0,0,janb84;l0rinc;pinheadmz,,Fixes a minor typo in documentation by replacing double dots (..) with proper ellipsis (…) formatting. The issue was identified by a translator working on Transifex.,This change likely improves the professional appearance of Bitcoin Core's user interface and may help ensure consistent formatting across different language translations.,docs,docs
32499,cmake: Restrict MSVC-specific workaround to affected versions,https://github.com/bitcoin/bitcoin/pull/32499,closed,2025-05-14T14:56:54Z,,2025-05-16T07:04:33Z,Windows;Build system,Build system,1,9,4,1,2,1,davidgumberg,,"Removes a compiler workaround that was only needed for older MSVC versions, allowing the fuzz/utxo_snapshot.cpp file to compile normally with MSVC 17.14 and later. The workaround is now restricted to only the affected older compiler versions.","This change likely improves code maintainability and may help ensure that fuzzing tests for UTXO snapshots can run properly on Windows systems with updated compilers, potentially strengthening Bitcoin Core's testing coverage.",build,cleanup
32537,Set minimum supported Windows version to 1903 (May 2019 Update),https://github.com/bitcoin/bitcoin/pull/32537,closed,2025-05-16T16:32:45Z,,2025-05-19T15:01:06Z,Windows;Build system,Build system,2,19,3,3,4,2,laanwj,,Updates the minimum supported Windows version to 1903 (May 2019 Update) and adds verification in the symbol-check.py script to ensure application manifests specify supported OS versions. This change enables UTF-8 code page support required for another PR.,"This change likely modernizes Bitcoin Core's Windows compatibility and may help ensure proper Unicode text handling on Windows systems, which could be important for international users and wallet functionality involving non-ASCII characters.",build,feature
32550,cmake: Add missed `SSE41_CXXFLAGS`,https://github.com/bitcoin/bitcoin/pull/32550,closed,2025-05-18T13:47:26Z,,2025-05-19T13:59:42Z,Build system,Build system,1,1,1,1,0,1,,,Adds missing SSE41_CXXFLAGS compiler flags to the CMake build system. The missing flags were discovered when building Bitcoin Core with clang-cl on Windows.,"This change likely ensures that SSE4.1 optimizations are properly enabled during compilation, which may help improve Bitcoin Core's performance on systems that support these CPU instructions, particularly for cryptographic operations.",build,bugfix
32551,"cmake: Remove `ENABLE_{SSE41,AVX2,X86_SHANI,ARM_SHANI}` from `bitcoin-build-config.h`",https://github.com/bitcoin/bitcoin/pull/32551,merged,2025-05-18T15:24:07Z,2025-05-22T09:00:14Z,2025-05-22T09:00:14Z,Build system,Build system,5,2,28,5,0,3,fanquake,,Removes redundant global definitions of CPU feature flags from the build configuration header since they're already defined locally where needed.,This cleanup likely improves build system maintainability and may reduce compilation complexity by avoiding duplicate symbol definitions across different build targets.,build,cleanup
32552,refactor: Remove workaround for resolved MSVC bug,https://github.com/bitcoin/bitcoin/pull/32552,closed,2025-05-18T16:33:51Z,,2025-05-18T17:17:06Z,Refactoring,,1,7,17,1,0,0,,,Removes a workaround that was previously needed for an MSVC compiler bug that has since been fixed in newer Visual Studio versions.,"This appears to simplify the codebase by eliminating technical debt, which may improve code readability and reduce maintenance burden now that the underlying compiler issue is resolved.",build,cleanup
32564,"miniscript, refactor: Make `operator""""_mst` `consteval` (re-take)",https://github.com/bitcoin/bitcoin/pull/32564,merged,2025-05-19T13:47:25Z,2025-07-02T14:06:38Z,2025-07-02T14:06:38Z,Refactoring,,2,30,37,3,5,44,hodlinator,,Makes the miniscript string literal operator compile-time evaluated (consteval) now that blocking MSVC bugs have been resolved.,"This likely improves performance by moving miniscript parsing from runtime to compile-time, and may help catch miniscript syntax errors earlier during the build process rather than at runtime.",utils,refactor
32567,subprocess: Backport upstream changes,https://github.com/bitcoin/bitcoin/pull/32567,merged,2025-05-20T10:56:27Z,2025-05-21T11:08:41Z,2025-05-21T11:08:41Z,,,1,6,1,1,0,1,laanwj,,Updates the embedded subprocess library by backporting upstream bug fixes and improvements from the original cpp-subprocess project.,"This likely improves reliability and security of subprocess handling in Bitcoin Core, which may be important for external process communication used in various Core utilities and testing infrastructure.",utils,bugfix
32577,subprocess: Let shell parse command on non-Windows systems,https://github.com/bitcoin/bitcoin/pull/32577,closed,2025-05-21T11:45:24Z,,2026-01-20T10:30:59Z,Utils/log/libs;Needs rebase,Utils/log/libs,2,57,11,5,8,243,fanquake;hebasto;laanwj,,"Modifies subprocess handling to let the shell parse commands on non-Windows systems, fixing an issue with command execution.","This appears to resolve subprocess execution problems on Unix-like systems, which likely improves the reliability of Bitcoin Core's external process interactions and may fix issues with certain utilities or test suites.",utils,bugfix
32601,test: Fix `system_tests/run_command` test,https://github.com/bitcoin/bitcoin/pull/32601,closed,2025-05-23T12:51:35Z,,2025-07-04T10:25:40Z,Tests;CI failed,Tests,1,15,6,3,11,41,maflcko,,Fixes a test that checks command execution by ensuring it validates the exact exit code (1) and properly handles error message parsing by removing process invocation strings from exception messages.,"This fix likely ensures the test suite accurately validates error handling behavior, which may help catch regressions in command-line interface functionality and improve overall code reliability.",tests,bugfix
32633,windows: Use predefined `RC_INVOKED` macro instead of custom one,https://github.com/bitcoin/bitcoin/pull/32633,merged,2025-05-28T19:13:02Z,2025-05-29T12:51:15Z,2025-05-29T12:51:15Z,Windows;Build system,Build system,1,3,11,2,0,0,fanquake;hodlinator,,Replaces a custom macro with the standard Windows predefined `RC_INVOKED` macro in resource compilation.,"Using standard Windows macros likely improves build system compatibility and maintainability, potentially reducing issues with Windows resource compilation and making the codebase more consistent with Windows development practices.",build,cleanup
32634,build: Add resource file and manifest to `bitcoin.exe`,https://github.com/bitcoin/bitcoin/pull/32634,merged,2025-05-28T19:26:28Z,2025-05-29T09:42:16Z,2025-05-29T09:42:16Z,Windows;Build system,Build system,2,35,0,2,3,0,hodlinator,,Adds a resource file and application manifest to the `bitcoin.exe` executable for consistency with other Windows executables.,"Adding proper Windows metadata and manifests likely ensures bitcoin.exe behaves correctly on Windows systems, may help with compatibility across different Windows versions, and appears necessary for proper release binary functionality.",build,feature
32648,"cmake, qt: Process `*.qrc` files manually",https://github.com/bitcoin/bitcoin/pull/32648,closed,2025-05-30T16:35:00Z,,2025-07-02T13:18:41Z,Build system,Build system,2,35,5,1,0,32,,,"Modifies the CMake build system to manually process Qt resource files, enabling control over compiler properties to silence specific warnings like trailing whitespace.","This change likely improves the build experience by reducing compiler warning noise, which may help developers focus on legitimate issues and could make the build process more robust across different compiler versions.",build,refactor
32651,cmake: Replace deprecated `qt6_add_translation` with `qt6_add_lrelease`,https://github.com/bitcoin/bitcoin/pull/32651,merged,2025-05-30T21:24:23Z,2025-06-04T14:36:29Z,2025-06-04T14:36:29Z,Build system,Build system,1,7,7,1,4,4,fanquake,,Updates the CMake configuration to use the newer `qt6_add_lrelease` function instead of the deprecated `qt6_add_translation` for Qt translation handling.,Replacing deprecated Qt functions likely ensures continued compatibility with newer Qt versions and may help prevent future build failures as Qt development progresses and older APIs are removed.,build,cleanup
32662,doc: Remove build instruction for running `clang-tidy`,https://github.com/bitcoin/bitcoin/pull/32662,merged,2025-06-02T12:50:17Z,2025-06-02T13:46:07Z,2025-06-02T13:46:07Z,Docs,Docs,1,0,1,1,0,0,TheCharlatan;janb84,,Removes outdated build instructions for running clang-tidy since the CMake compilation database allows running it without building the code first.,This likely improves developer experience by simplifying the documentation and may help developers run static analysis tools more efficiently without unnecessary compilation steps.,docs,docs
32667,build: Find Boost in config mode,https://github.com/bitcoin/bitcoin/pull/32667,merged,2025-06-02T21:14:25Z,2025-06-27T13:55:02Z,2025-06-27T13:55:02Z,Build system,Build system,1,5,24,1,2,24,fanquake,,Updates the build system to find Boost libraries using config mode instead of the deprecated FindBoost module.,This appears to be necessary for compatibility with newer CMake versions and may help ensure Bitcoin Core continues building correctly as build tools evolve.,build,bugfix
32668,refactor: Drop unused `#include <boost/operators.hpp>`,https://github.com/bitcoin/bitcoin/pull/32668,closed,2025-06-02T22:01:56Z,,2025-07-02T13:39:36Z,Refactoring,,1,0,2,2,0,29,,,Removes an unused include of boost/operators.hpp header from the mini_miner.cpp file.,"This likely reduces compilation overhead and may help minimize dependencies, potentially improving build times and reducing the attack surface of included code.",build,cleanup
32709,cmake: Fix `FindQt` module,https://github.com/bitcoin/bitcoin/pull/32709,closed,2025-06-09T11:34:24Z,,2026-02-13T10:46:52Z,Build system,Build system,2,12,3,1,13,248,BrandonOdiwuor;fanquake,,Fixes the FindQt CMake module to properly treat missing Qt components as fatal errors and cleans up cache variables after Qt 6 migration.,This likely improves build reliability by ensuring missing GUI dependencies are caught early and may help developers avoid configuration issues when building the Qt-based GUI.,build,bugfix
32716,depends: Override host compilers for FreeBSD and OpenBSD,https://github.com/bitcoin/bitcoin/pull/32716,merged,2025-06-10T14:02:52Z,2025-07-03T10:00:51Z,2025-07-03T10:00:51Z,Build system,Build system,1,8,0,2,0,22,,,"Fixes compiler selection for FreeBSD and OpenBSD on aarch64 by defaulting to Clang instead of GCC, matching the system defaults.",This likely ensures Bitcoin Core builds correctly on these BSD systems and may help prevent compilation failures or suboptimal binaries when using the wrong compiler toolchain.,build,bugfix
32717,doc: Update Qt 6 packages on FreeBSD,https://github.com/bitcoin/bitcoin/pull/32717,merged,2025-06-10T16:50:12Z,2025-06-13T08:37:46Z,2025-06-13T08:37:46Z,Docs,Docs,1,2,2,1,2,2,vasild,,Updates documentation to reflect the correct Qt 6 package names for FreeBSD systems.,"This likely helps FreeBSD users correctly install the required Qt dependencies when building Bitcoin Core's GUI, which may reduce build errors and improve the user experience for developers on FreeBSD systems.",docs,docs
32731,depends: Build `qt` package for FreeBSD hosts,https://github.com/bitcoin/bitcoin/pull/32731,merged,2025-06-11T21:43:20Z,2025-06-26T16:29:06Z,2025-06-26T16:29:06Z,Build system,Build system,1,10,3,5,15,14,Sjors;vasild,,"Enables building the Qt package in the depends system specifically for FreeBSD hosts, allowing Bitcoin-Qt to run natively on FreeBSD.","This appears to expand Bitcoin Core's platform support by making the GUI application available to FreeBSD users, which may help broaden Bitcoin's accessibility and reduce reliance on Linux-only development environments.",build,feature
32764,guix: Build for macOS using Clang only,https://github.com/bitcoin/bitcoin/pull/32764,open,2025-06-17T13:39:41Z,,,Build system,Build system,1,38,17,2,9,,fanquake;w0xlt,,Changes the macOS build system to use only Clang compiler with libc++ instead of mixing compilers.,"This likely improves build consistency and reliability on macOS by eliminating potential compatibility issues between different compilers, which may reduce build failures and make the development process more predictable for macOS contributors.",build,refactor
32773,cmake: Create subdirectories in build tree in advance,https://github.com/bitcoin/bitcoin/pull/32773,merged,2025-06-18T19:52:41Z,2026-02-09T11:04:04Z,2026-02-09T11:04:04Z,Build system;Tests,Build system,2,62,14,1,3,235,BrandonOdiwuor;janb84;m3dwards;sedited,,Fixes CMake build issues by ensuring subdirectories are created before attempting to create symbolic links in the test directory structure.,"This appears to resolve a build system bug where symlink creation would fail and fall back to copying files, which may improve build reliability and ensure the intended file structure is maintained during testing.",build,bugfix
32804,Fix build on macOS when `qt@6` is installed,https://github.com/bitcoin/bitcoin/pull/32804,closed,2025-06-24T16:46:13Z,,2025-06-26T14:03:58Z,Build system,Build system,2,15,3,2,0,1,,,Resolves build conflicts that occur on macOS systems when the qt@6 package is already installed via Homebrew.,"This likely prevents build failures for macOS developers who have Qt installed system-wide, which may reduce friction in the development setup process and make it easier for contributors to build Bitcoin Core locally.",build,bugfix
32805,cmake: Use `HINTS` instead of `PATHS` in `find_*` commands,https://github.com/bitcoin/bitcoin/pull/32805,merged,2025-06-24T20:05:18Z,2025-06-26T11:10:08Z,2025-06-26T11:10:08Z,Build system,Build system,1,3,3,1,0,1,fanquake,,"Changes CMake configuration to use HINTS instead of PATHS when finding dependencies, which affects search order and symlink resolution. This ensures Homebrew's libqrencode is found at its real path rather than via symlinks.","This change likely improves build reliability on macOS by ensuring dependencies are located more predictably, which may help prevent build failures or unexpected behavior when multiple versions of libraries are present on the system.",build,bugfix
32814,cmake: Explicitly specify `Boost_ROOT` for Homebrew's package,https://github.com/bitcoin/bitcoin/pull/32814,merged,2025-06-25T17:53:39Z,2025-06-26T14:00:54Z,2025-06-26T14:00:54Z,macOS;Build system,Build system,1,12,0,1,0,0,fanquake,,Explicitly specifies Boost_ROOT for Homebrew's Boost package on macOS to ensure it's found at the real path rather than through symlinks. This prevents contamination of include directories by broad locations that interfere with Qt framework flags.,"This appears to be critical for maintaining clean build environments on macOS, as it likely prevents header conflicts that could lead to compilation errors or subtle runtime issues when building Bitcoin Core with Qt dependencies.",build,bugfix
