pr_number,title,url,status,created_at,merged_at,closed_at,labels,component,num_commits,additions,deletions,changed_files,review_comments_count,days_open,reviewers,related_issues,summary,potential_rationale,category,change_type
32828,"build, docs: Fix Boost-related issues on NetBSD",https://github.com/bitcoin/bitcoin/pull/32828,merged,2025-06-29T19:05:45Z,2025-07-02T12:29:55Z,2025-07-02T12:29:55Z,Build system,Build system,2,10,1,2,2,2,fanquake,,"Fixes Boost-related build issues on NetBSD by updating documentation to recommend the full boost package instead of boost-headers, and addresses broken CMake configuration files in the NetBSD package system.","This change likely ensures Bitcoin Core remains buildable on NetBSD systems, which may help maintain platform diversity and accessibility for users and developers who prefer this BSD variant for security or philosophical reasons.",build,bugfix
32856,Update `minisketch` subtree,https://github.com/bitcoin/bitcoin/pull/32856,merged,2025-07-02T10:17:23Z,2025-11-10T14:06:06Z,2025-11-10T14:06:06Z,Build system,Build system,2,467,4,9,8,131,BrandonOdiwuor;purpleKarrot,,"Updates the minisketch subtree to the latest upstream version, incorporating recent improvements and fixes from the minisketch library.","This update likely brings performance improvements or bug fixes to Bitcoin Core's transaction relay optimization features, which may help improve network efficiency and reduce bandwidth usage during block propagation.",build,feature
32858,doc: Add workaround for vcpkg issue with paths with embedded spaces,https://github.com/bitcoin/bitcoin/pull/32858,merged,2025-07-02T14:46:43Z,2025-07-03T15:24:18Z,2025-07-03T15:24:18Z,Docs;Windows,Docs,1,23,13,1,0,1,,,Adds documentation workaround for a vcpkg issue that occurs when building on Windows systems with file paths containing embedded spaces.,"This change likely improves the developer experience on Windows by preventing build failures in common scenarios where users have spaces in their directory names, which may help lower barriers to contribution and testing on Windows platforms.",docs,docs
32940,cmake: Use newer signature of `qt6_add_lrelease` when available,https://github.com/bitcoin/bitcoin/pull/32940,merged,2025-07-10T15:47:13Z,2025-07-11T13:26:20Z,2025-07-11T13:26:20Z,Build system,Build system,1,5,4,1,0,0,fanquake,,"Updates the CMake build system to use a newer signature of the qt6_add_lrelease function when it's available, fixing a compatibility issue.","This likely helps ensure Bitcoin Core can build successfully with newer versions of Qt6, which may be important for maintaining compatibility with modern development environments and ensuring the GUI remains buildable across different Qt versions.",build,bugfix
32943,depends: Force `CMAKE_EXPORT_NO_PACKAGE_REGISTRY=TRUE`,https://github.com/bitcoin/bitcoin/pull/32943,merged,2025-07-10T19:20:11Z,2025-07-14T12:32:51Z,2025-07-14T12:32:51Z,Build system,Build system,1,1,0,1,0,3,,,Forces CMake to disable package registry population by setting CMAKE_EXPORT_NO_PACKAGE_REGISTRY=TRUE globally to prevent build artifacts from being written outside the build tree.,"This appears to improve build isolation and reproducibility by preventing CMake from writing to user package registries outside the build directory, which may help ensure cleaner builds and reduce potential conflicts in development environments.",build,cleanup
32951,"build: Explicitly set Qt's `AUTO{MOC,RCC,UIC}` property per target",https://github.com/bitcoin/bitcoin/pull/32951,closed,2025-07-11T22:21:22Z,,2026-03-03T13:23:15Z,Build system;Needs rebase,Build system,2,42,15,2,0,234,,,"Explicitly sets Qt's AUTOMOC, AUTORCC, and AUTOUIC properties per target rather than relying on default behavior for handling Qt's code generation tools.","This likely provides more explicit control over Qt's automatic code generation processes, which may help ensure consistent behavior across different CMake versions and improve build reliability for the GUI components.",build,refactor
32953,[POC] ci: Skip compilation when running static code analysis,https://github.com/bitcoin/bitcoin/pull/32953,closed,2025-07-12T12:51:19Z,,2026-03-03T13:29:44Z,Tests;Needs rebase,Tests,3,22,15,4,2,234,maflcko,,Proof of concept that skips compilation when running static code analysis tools like clang-tidy by using a compilation database instead.,"This may significantly speed up static analysis in continuous integration by avoiding the need to actually compile the code when only running analysis tools, potentially reducing CI runtime and resource usage while still maintaining code quality checks.",tests,performance
32954,"cmake: Drop no longer necessary ""cmakeMinimumRequired"" object",https://github.com/bitcoin/bitcoin/pull/32954,merged,2025-07-12T13:05:52Z,2025-07-14T10:06:45Z,2025-07-14T10:06:45Z,Build system,Build system,1,0,1,1,0,1,fanquake,,Removes a no longer necessary cmakeMinimumRequired object from the build system since the minimum CMake version is already specified as 3.22.,"This appears to be a cleanup that removes redundant code now that Bitcoin Core has established a minimum CMake version requirement, likely simplifying the build configuration and reducing maintenance overhead.",build,cleanup
33077,kernel: create monolithic kernel static library,https://github.com/bitcoin/bitcoin/pull/33077,merged,2025-07-28T09:50:54Z,2025-08-06T12:09:02Z,2025-08-06T12:09:02Z,Build system,Build system,1,7,33,2,0,9,TheCharlatan;stickies-v,,Creates a monolithic static library for the Bitcoin kernel that includes all dependency object files in a single library file. This simplifies distribution by eliminating the need for separate dependency libraries when using libbitcoinkernel.a.,"This change likely makes it easier for external projects to integrate Bitcoin's kernel library by reducing dependency management complexity, which may encourage broader adoption of Bitcoin Core's validation and consensus logic in other applications.",build,feature
33101,cmake: Proactively avoid use of `SECP256K1_DISABLE_SHARED`,https://github.com/bitcoin/bitcoin/pull/33101,merged,2025-07-30T12:48:29Z,2025-08-06T10:31:22Z,2025-08-06T10:31:22Z,Build system,Build system,2,53,48,2,0,6,fanquake;theuni,,Removes usage of the SECP256K1_DISABLE_SHARED CMake variable that has been deprecated upstream. This proactively prevents build breakage when the secp256k1 library is next updated.,"This appears to be maintenance work that ensures Bitcoin Core's build system remains compatible with upstream dependencies, likely preventing future compilation failures and keeping the codebase aligned with modern cryptographic library standards.",build,cleanup
33113,refactor: Use immediate lambda to work around GCC bug 117966,https://github.com/bitcoin/bitcoin/pull/33113,merged,2025-08-01T11:16:38Z,2025-08-06T10:12:25Z,2025-08-06T10:12:25Z,Refactoring,,2,7,2,2,0,4,,31244,Implements a workaround using immediate lambda functions to fix a compilation bug in GCC versions 13 and 14 when using the debug flag. This resolves build failures on affected compiler versions.,"This fix likely ensures Bitcoin Core can be compiled and debugged on a wider range of development environments, which may improve developer productivity and make the codebase more accessible to contributors using newer GCC versions.",build,bugfix
33115,cmake: Switch to generated `ts_files.cmake` file,https://github.com/bitcoin/bitcoin/pull/33115,merged,2025-08-01T12:31:21Z,2025-08-06T09:47:12Z,2025-08-06T09:47:12Z,GUI;Build system,GUI,3,7201,41826,63,8,4,BrandonOdiwuor;fanquake;maflcko,32653,Restructures Qt translation file handling by moving it to a dedicated locale directory and switching from file globbing to an explicit list generated by maintainer tools. This improves the reliability of translation file management in the CMake build system.,"This change likely makes the build process more deterministic and maintainable for internationalization, which may improve Bitcoin Core's accessibility to non-English speaking users by ensuring more reliable translation integration.",gui,refactor
33152,"Release: Prepare ""Open Transifex translations for v30.0"" step",https://github.com/bitcoin/bitcoin/pull/33152,merged,2025-08-07T10:56:37Z,2025-08-08T15:41:09Z,2025-08-08T15:41:09Z,,,3,2067,2219,8,0,1,laanwj;stickies-v,,Prepares the necessary infrastructure to open Transifex translations for the upcoming v30.0 release. This follows the established release process for managing internationalization workflow.,"This appears to be part of the standard release preparation process that ensures Bitcoin Core v30.0 can be properly translated into multiple languages, likely improving global accessibility and user adoption of the new version.",gui,feature
33156,cmake: Do not require Python to build GUI,https://github.com/bitcoin/bitcoin/pull/33156,closed,2025-08-08T12:51:04Z,,2025-08-18T12:15:20Z,Docs;Build system;Needs rebase,Docs,2,5,1,2,0,9,pablomartin4btc,,This PR modifies the CMake build system to remove the Python dependency when building the Bitcoin Core GUI.,"This change likely simplifies the build process for developers who only want to build the GUI components, potentially reducing barriers to contribution and making the build system more modular by removing unnecessary dependencies.",build,bugfix
33164,Avoid file overwriting in fallback `AllocateFileRange` implementation,https://github.com/bitcoin/bitcoin/pull/33164,open,2025-08-09T20:38:15Z,,,Block storage,,1,18,7,1,11,,luke-jr,,"This PR fixes a bug in the fallback AllocateFileRange implementation that was overwriting file content, causing issues during blockchain reindexing on certain operating systems.","This fix appears to be critical for ensuring Bitcoin Core works correctly on OpenBSD, NetBSD, OmniOS, and OpenIndiana systems, likely preventing data corruption during reindex operations which could compromise node reliability on these platforms.",other,bugfix
33171,ci: Update `actions/checkout` version,https://github.com/bitcoin/bitcoin/pull/33171,merged,2025-08-11T13:56:03Z,2025-08-13T09:51:51Z,2025-08-13T09:51:51Z,Tests,Tests,1,6,6,1,0,1,janb84;jonatack;pablomartin4btc,,This PR updates the GitHub Actions checkout action to version 5.0.0 in the continuous integration system.,"Updating CI dependencies may help ensure the automated testing infrastructure remains secure and functional, likely providing access to newer features and bug fixes that could improve the development workflow.",tests,cleanup
33193,"Release: Prepare ""Translation string freeze"" step",https://github.com/bitcoin/bitcoin/pull/33193,merged,2025-08-15T12:58:29Z,2025-08-20T16:27:13Z,2025-08-20T16:27:13Z,,,1,689,818,3,0,5,janb84,31296;31453;32896;33209,This PR prepares for the translation string freeze step in the Bitcoin Core release process by updating translatable strings.,"This change likely ensures that new user-facing text added in recent PRs can be properly translated by the community, potentially improving accessibility for non-English speaking Bitcoin users worldwide.",docs,docs
33194,cmake: Collect headers for extracting translatable strings,https://github.com/bitcoin/bitcoin/pull/33194,closed,2025-08-15T13:20:23Z,,2025-08-16T11:23:00Z,Build system,Build system,1,11,36,1,0,0,,31296;33193,This PR modifies the CMake build system to include header files when extracting translatable strings for the translation process.,"This improvement likely ensures that translatable strings located in header files are not missed during the extraction process, potentially providing more complete translations for the user interface and improving the international user experience.",build,bugfix
33215,Fix compatibility with `-debuglogfile` command-line option,https://github.com/bitcoin/bitcoin/pull/33215,merged,2025-08-19T10:59:57Z,2026-03-19T23:41:20Z,2026-03-19T23:41:20Z,,,1,6,5,5,7,212,luke-jr;sedited,,Fixes hardcoded 'debug.log' filename to properly support custom debug log filenames specified via the `-debuglogfile` command-line option.,"This likely improves operational flexibility for node operators who may want to customize log file locations or naming schemes, which could be important for deployment automation or compliance with organizational logging standards.",utils,bugfix
33275,Release: 30.0 translations update,https://github.com/bitcoin/bitcoin/pull/33275,merged,2025-09-01T15:10:47Z,2025-09-09T09:20:11Z,2025-09-09T09:20:11Z,GUI,GUI,1,10140,26645,123,7,7,l0rinc,,Updates translations for the 30.0 release as part of the standard release process workflow.,"Translation updates may help broaden Bitcoin Core's accessibility to non-English speaking users, potentially supporting wider global adoption and usability of the reference implementation.",gui,docs
33312,clang-tidy: Disable `UndefinedBinaryOperatorResult` check in `src/ipc`,https://github.com/bitcoin/bitcoin/pull/33312,merged,2025-09-04T22:09:40Z,2025-09-08T20:28:21Z,2025-09-08T20:28:21Z,,,1,5,0,2,0,3,ryanofsky,,Disables a clang-tidy check that produces false positive warnings in IPC-related source files generated by the mpgen tool.,"This appears to improve the development experience by reducing noise from static analysis tools, which may help developers focus on legitimate code quality issues and maintain cleaner build processes.",build,cleanup
33340,Fix benchmark CSV output,https://github.com/bitcoin/bitcoin/pull/33340,merged,2025-09-08T11:14:24Z,2025-09-09T09:11:33Z,2025-09-09T09:11:34Z,,,1,4,4,1,2,0,janb84;l0rinc,,Replaces comma with semicolon in benchmark naming to fix broken CSV output format in bench_bitcoin.,"This likely improves the reliability of performance testing workflows, which may be important for developers and researchers analyzing Bitcoin Core's performance characteristics over time.",tests,bugfix
33379,cmake: Fix regression in `secp256k1.cmake`,https://github.com/bitcoin/bitcoin/pull/33379,merged,2025-09-12T17:00:41Z,2025-09-15T08:49:35Z,2025-09-15T08:49:35Z,Build system,Build system,1,2,1,1,0,2,TheCharlatan;furszy,,Fixes a CMake regression in secp256k1 configuration that violated CMake's function scope restrictions for enable_language() calls.,"This appears to restore proper CMake build functionality, which may be critical for developers using CMake-based build workflows and could prevent build failures on certain platforms or configurations.",build,bugfix
33407,cmake: Install `bitcoin` manpage,https://github.com/bitcoin/bitcoin/pull/33407,merged,2025-09-16T13:20:47Z,2025-09-17T08:57:13Z,2025-09-17T08:57:13Z,Build system,Build system,1,1,1,1,0,0,ryanofsky,,This PR adds the installation of the bitcoin manpage to the CMake build system. It appears to be a follow-up amendment to a previous PR that may have missed including the manpage installation.,"This likely improves the user experience for those building Bitcoin from source by ensuring documentation is properly installed with the binary, which may help with adoption and ease of use.",build,bugfix
33408,msvc: Update vcpkg manifest,https://github.com/bitcoin/bitcoin/pull/33408,merged,2025-09-16T21:15:24Z,2025-09-23T19:54:43Z,2025-09-23T19:54:44Z,Windows;Build system,Build system,1,2,2,1,0,6,,1,"This PR updates the vcpkg manifest for Windows builds, upgrading several dependencies including Boost (1.87.0 to 1.88.0), Qt components (6.8.2 to 6.9.1), and SQLite (3.49.1 to 3.50.4).","Updating dependencies likely brings security fixes, performance improvements, and bug fixes from upstream projects, which may enhance Bitcoin's stability and security on Windows platforms.",build,cleanup
33445,"ci: Update Clang in ""tidy"" job",https://github.com/bitcoin/bitcoin/pull/33445,merged,2025-09-20T16:13:30Z,2025-11-04T10:16:14Z,2025-11-04T10:16:14Z,Tests,Tests,2,22,14,10,15,44,fanquake;ryanofsky;vasild,,"This PR updates the CI system to use IWYU 0.25 with Clang 21 and fixes new compiler warnings, including suppressing a false positive in the interpreter code.","Keeping CI tools updated likely helps maintain code quality and catches potential issues earlier in development, while fixing compiler warnings may prevent future bugs and improve code maintainability.",tests,cleanup
33451,doc: Add `INSTALL.md` to Linux release tarballs,https://github.com/bitcoin/bitcoin/pull/33451,merged,2025-09-21T19:32:43Z,2026-03-13T20:20:20Z,2026-03-13T20:20:20Z,Docs,Docs,1,30,0,2,6,173,fanquake;janb84;sedited;w0xlt,,This PR adds installation instructions (INSTALL.md) to Linux release tarballs to provide setup guidance for popular desktop distributions.,Including installation instructions in release packages likely reduces barriers to adoption by making it easier for users to properly install Bitcoin on their Linux systems without needing to search for documentation elsewhere.,docs,docs
33452,Release: 30.0rc2 translations update,https://github.com/bitcoin/bitcoin/pull/33452,merged,2025-09-21T20:47:33Z,2025-09-23T14:18:58Z,2025-09-23T14:18:58Z,Backport,,1,143,151,2,0,1,,,"This PR updates Spanish and Czech translations for the 30.0rc2 release candidate, addressing specific review comments from the translation process.","Improving translations likely makes Bitcoin more accessible to non-English speaking users, which may help with global adoption and usability of the software.",other,docs
33494,depends: Update URL for `qrencode` package source tarball,https://github.com/bitcoin/bitcoin/pull/33494,merged,2025-09-29T13:36:30Z,2025-10-07T23:58:10Z,2025-10-07T23:58:10Z,Build system,Build system,4,5,6,2,2,8,janb84;luke-jr;vasild,,Updates the download URL for the qrencode package source tarball from fukuchi.org to GitHub releases page due to the original source being unavailable.,"This change likely ensures the Bitcoin Core build system can continue to reliably download dependencies needed for QR code functionality, which may be important for wallet address sharing and payment request features.",build,bugfix
33541,Release: 30.0rc3 translations update,https://github.com/bitcoin/bitcoin/pull/33541,merged,2025-10-05T10:58:15Z,2025-10-06T09:24:12Z,2025-10-06T09:24:12Z,Backport,,1,337,388,1,0,0,janb84,,Updates Polish translation strings for the 30.0rc3 release candidate while skipping other language updates to focus review effort.,"This appears to improve accessibility for Polish-speaking Bitcoin users by providing more accurate translations, which may help expand Bitcoin adoption in Polish-speaking regions.",other,docs
33561,[28.x] ci: Fix Qt 5.15 URL,https://github.com/bitcoin/bitcoin/pull/33561,merged,2025-10-07T11:13:16Z,2025-10-07T13:52:49Z,2025-10-07T13:52:49Z,Backport,,1,2,2,2,0,0,,,Fixes the Qt 5.15 download URL in the continuous integration system for the 28.x branch.,"This likely ensures that automated builds on the 28.x branch can continue to function properly by accessing the correct Qt library version, which may be critical for maintaining GUI functionality in older releases.",build,bugfix
33593,guix: Use UCRT runtime for Windows release binaries,https://github.com/bitcoin/bitcoin/pull/33593,open,2025-10-09T21:46:43Z,,,Windows;Build system;Needs rebase,Build system,4,57,78,9,10,,fanquake;maflcko;trevarj,,Switches Windows release binaries from MSVCRT to UCRT runtime and removes related workarounds while updating documentation.,"This change likely modernizes Windows compatibility and may improve performance or security by using a more current runtime library, potentially making Bitcoin Core more reliable on newer Windows systems.",build,refactor
33725,"ci, iwyu: Treat warnings as errors for `src/init` and `src/policy`",https://github.com/bitcoin/bitcoin/pull/33725,closed,2025-10-28T17:12:52Z,,2025-12-22T23:23:37Z,Refactoring;Tests;Needs rebase,Tests,4,64,39,28,13,55,fanquake;maflcko,31308,Extends the Include What You Use (IWYU) tool to treat warnings as errors in the src/init and src/policy directories to improve code quality.,This appears to enforce stricter code hygiene standards which may help prevent compilation issues and improve maintainability of critical Bitcoin Core components related to initialization and policy validation.,build,cleanup
33764,ci: Add Windows + UCRT jobs for cross-compiling and native testing,https://github.com/bitcoin/bitcoin/pull/33764,merged,2025-11-02T15:31:02Z,2025-11-28T16:42:51Z,2025-11-28T16:42:51Z,Windows;Tests,Tests,2,54,9,3,11,26,fanquake;maflcko,,Adds new CI jobs for Windows builds using the modern UCRT runtime instead of the older MSVCRT runtime. This includes both cross-compilation and native testing jobs.,"This change likely improves Windows compatibility and modernizes the build infrastructure, which may help ensure Bitcoin Core works reliably on newer Windows systems and appears to be preparing for eventual removal of legacy runtime support.",build,refactor
33774,cmake: Move IPC tests to `ipc/test`,https://github.com/bitcoin/bitcoin/pull/33774,merged,2025-11-04T13:10:04Z,2025-12-04T13:52:10Z,2025-12-04T13:52:10Z,Build system;Tests,Build system,2,51,48,10,4,30,janb84;ryanofsky,,Reorganizes IPC (Inter-Process Communication) tests in the CMake build system by moving them to a dedicated `ipc/test` directory. Also removes an unused clang-tidy configuration file.,"This organizational change likely improves code maintainability and may make it easier for developers to locate and work with IPC-related tests, which appears to support Bitcoin Core's modular architecture efforts.",build,refactor
33779,"ci, iwyu: Fix warnings in `src/kernel` and treat them as errors",https://github.com/bitcoin/bitcoin/pull/33779,merged,2025-11-04T17:03:05Z,2026-01-19T11:47:37Z,2026-01-19T11:47:37Z,Refactoring,,1,17,17,8,11,75,maflcko;sedited;willcl-ark,,Updates include-what-you-use (IWYU) checks to fix warnings in the `src/kernel` directory and configures the system to treat these warnings as errors.,"This change likely improves code quality and compilation reliability by ensuring proper header dependencies in the kernel module, which may help maintain clean separation between Bitcoin Core's components and reduce build issues.",build,cleanup
33781,clang-tidy: Remove no longer needed NOLINT,https://github.com/bitcoin/bitcoin/pull/33781,merged,2025-11-04T17:47:43Z,2025-11-05T10:06:41Z,2025-11-05T10:06:41Z,,,1,1,1,1,0,0,,,Removes unnecessary NOLINT comments from the codebase that were previously needed to suppress clang-tidy warnings but are no longer required.,"This cleanup likely reduces code noise and improves maintainability by removing obsolete linter suppressions, which may help developers focus on legitimate code quality issues without being distracted by outdated annotations.",build,cleanup
33810,ci: Add IWYU job,https://github.com/bitcoin/bitcoin/pull/33810,merged,2025-11-06T23:27:52Z,2025-12-22T17:39:46Z,2025-12-22T17:39:46Z,Tests,Tests,6,653,12,12,20,45,fanquake;maflcko;sedited;w0xlt,,"Creates a separate CI job specifically for include-what-you-use (IWYU) checks, moving them out of the existing tidy job to provide faster feedback to developers.","This change likely improves the development workflow by providing quicker feedback on header dependency issues, which may help developers catch and fix include problems earlier in the development process without waiting for longer-running CI jobs to complete.",tests,refactor
33818,ci: Extend tidy job to cover kernel code,https://github.com/bitcoin/bitcoin/pull/33818,merged,2025-11-07T12:44:46Z,2025-11-07T15:28:57Z,2025-11-07T15:28:57Z,Tests,Tests,1,1,1,1,3,0,maflcko,,Extends the continuous integration tidy job to include kernel code in automated code quality checks.,"This likely helps maintain code quality standards across Bitcoin's kernel components, which may be critical for ensuring the reliability and maintainability of core consensus and validation logic.",tests,test
33826,scripted-diff: Remove obsolete comment,https://github.com/bitcoin/bitcoin/pull/33826,merged,2025-11-08T16:48:39Z,2025-11-10T10:59:58Z,2025-11-10T10:59:58Z,Docs,Docs,1,6,6,5,0,1,rkrux,32697;32881,Removes outdated comments that became obsolete after previous changes to the codebase.,"This appears to help keep the codebase documentation current and accurate, which may reduce developer confusion and improve code maintainability.",docs,cleanup
33827,doc: Correct `pkgin` command usage on NetBSD,https://github.com/bitcoin/bitcoin/pull/33827,merged,2025-11-08T19:10:43Z,2025-11-10T10:29:23Z,2025-11-10T10:29:23Z,Docs,Docs,1,3,3,1,1,1,,,Fixes documentation for the pkgin package manager command on NetBSD by adding the required 'install' subcommand.,"This likely helps NetBSD users correctly install Bitcoin dependencies, potentially expanding the platform compatibility and user base for Bitcoin Core.",docs,docs
33841,cmake: Switch to `minisketch` upstream build system,https://github.com/bitcoin/bitcoin/pull/33841,open,2025-11-10T14:38:12Z,,,Build system,Build system,1,17,85,2,1,,BrandonOdiwuor,,Changes the build system to use minisketch's native build system instead of a custom integration.,This may help maintain better compatibility with upstream minisketch updates and could reduce maintenance burden by leveraging the library's official build configuration.,build,refactor
33852,"test, refactor: Fix `-Warray-bounds` warning",https://github.com/bitcoin/bitcoin/pull/33852,closed,2025-11-11T13:26:17Z,,2025-11-11T13:32:49Z,Refactoring;Tests,Tests,1,1,1,1,0,0,,,Fixes a compiler warning about array bounds that occurs when using GCC 14 for Windows cross-compilation.,"This likely helps ensure Bitcoin Core can be built cleanly with newer compiler versions, which may be important for maintaining build compatibility and catching potential memory safety issues.",tests,bugfix
